name, address,number,Availability,BGroup
Pacific Medical College and Hospital Blood Bank,"Bhilon ka Bedla, N.H. 27, Pratap Pura, Girwa","0294 3920000, 0294-2980077",YES,AB-
Central Blood Bank STNM Hospital,"STNM Hospital Complex ,NH 31A , Gangtok,  East Sikkim
",03592 207691,NO,AB-
Central Referral Hospital Blood Bank,"Manipal Central Referral Hospital , 5th Mile Tadong, 
Gangtok.
Sikkim Manipal Instutute of Medical Sciences, National Highway 31A",03592 231137 (EXTENSION 163),YES,AB-
Government General Hospital Blood Bank,"Namchi District Hospital, Hospital Road, Namchi",03595 264544,NO,AB-
Government  Head quarters Hospital,"Perambalur Road, Ariyalur",,,AB-
CANCER INSTITUTE HOSPITAL BLOOD BANK,"Cancer Institute (WIA) ,No.18 Sardar Patel road","044 22209150,044 24910754,044 22350241",YES,AB-
Rajiv Gandhi Government General Hospital,"General Hospital Road
Park Town,
Chennai, Tamil Nadu ","044 25305711,  044 2530 5000",YES,AB-
The Institute of Child Health and Hospital for Children,"Halls Road, Egmore, Chennai",044 28191132  044 2819 2138,YES,AB-
Government Kilpauk Medical College Hospital Blood Bank,"Government Kilpauk Medical College and Hospital,                    822, Poonamallee High Rd, Kilpauk, Chennai  ",044 28364955,YES,AB-
Southern Railway Headquarters Hospital,"Ayanavaram
Chennai, Tamil Nadu ",044 2674 1624,YES,AB-
ESIC Hospital And Occupational Diseases Centre Blood Bank,"Ashok Pillar Main Road, K.K. Nagar,Chennai",044 24893714  ,,AB-
Apollo Hospital Enterprises Limited Blood Bank,"No:21, Greams Lane, Off Greams Road, Thousand Lights West, Thousand Lights, Chennai ","044 28294870,  044 2829 0200",YES,AB-
Jeevan Blood Bank and Research Centre,"22/11, Wheatcrofts Road, Nungambakkam
Chennai, Tamil Nadu 600034",0435 20220    044 2826 3113,YES,AB-
Apollo Speciality Hospital Blood Bank,"4th Floor, Geo Tower, Old No.319, New No.465, Anna Salai, Nandanam, Chennai","044 24347288, 044 24331741, 044 24336119",YES,AB-
Madras Medical Mission(Institute of Cardio Vascular Diseses),"No. 4 Dr.Jayalalitha Nagar, Mogapair",044 26561801,YES,AB-
Kanchi Kamakoti Child Trust Hospital Blood Bank,"12 A, Nageshwara Road, Nungambakkam, Chennai","044 42001800, Extn 205",,AB-
Vijaya Hospital Blood Bank,"New No: 434 (OId No: 180), N.S.K Salai, Vadapalani","044 24881392, 044 24842931, 044 24802221, 044 24802165,",YES,AB-
MIOT Hospital Blood Bank,"No. 4/112 Mount Poonamelle Road, Manapakkam, Chennai","044 22492288, 044 42002288",YES,AB-
Hindu Mission Hospital Blood Bank,"103, GST Road, Tambram, Patel Nagar, Tambaram,Chennai","044 22262244, Extn 193  ",NO,AB-
Lions Blood Bank and Research Centre,"Doctors Plaza No. 5A/1  V.O.C. Street  Opposite to Shanmugan Road, West Tambram",044 2261474,NO,AB-
International Centre for Cardio Thoracic and Vascular Diseases,"R-30c, Ambattur Industrial Estate Road, Mogappair,Chennai","044 42017575, 044 26564224  ",YES,AB-
Dr.Kamatchi Memorial and Blood Component Research Centre ,"Run by Kamatchi Memorial Trust, 1 Radial Road, Pallikaranai, Rose Avenue, Chennai",044 66300300  ,YES,AB-
Bharathiraja Speciality Hospital Blood Bank,"20 Gopathi Narayanaswami Chetty Road, Thiyagaraya Nagar
Parthasarathy Puram, T.Nagar Chennai",044 3011 3011,NO,AB-
Global Hospitals Blood Bank (A unit of Rabindranath GE Medical Association Pvt Ltd,"439, Cheran Nagar, Perumbakkam
Cheran Nagar, Perumbakkam,
Chennai",044 22777000,YES,AB-
Sri Ramachandra Medical College and Research Institute Blood Bank,"No.1, Ramachandra Nagar, Porur, Chennai","044 24768027, 044 24768031, 044 24768033, 044 45928500",YES,AB-
Rotary Blood Bank,"Medavakkam Main Rd, Vanuvampet, Madipakkam, Chennai",044 43584482  044 2242 2639,YES,AB-
St Thomas Blood Bank and Research Centre St Thomas Hospital,"5/105, II floor Defence Colony Road, St. Thomas Mount",044 22319393,YES,AB-
Right Hospitals Blood Bank,"No.1, Professor Subramaniam Street, Kilpauk",044 26403939,YES,AB-
Apollo Hospitals Blood Bank,"Run by Apollo Hospitals Educational Trust, No. 64, Fourth Floor, Vanagaram to Ambattur Main Road, Ayanambakkam",044 26533429,YES,AB-
Landsteiner Lakshmi Memorial Research Foundation,"14/90, Ground Floor, First Floor and Second Floor, Ayyavoo Street, Aminijikarai","044 42320000, 044 26644111",YES,AB-
Madras Egmore Lions Blood Bank and Research Foundation,"Egmore Lions Blood Bank and Research Foundation, 130 Marshall Road, Egmore
Chennai","044 28414949, 044 28414959, 044 28415959",YES,AB-
Government Royapettah Hospital Blood Bank,"No 1, Westcott Road, Royapettah, Chennai, Tamil Nadu ","044 28482611,  044 28483053",NO,AB-
Government Peripheral Hospital Blood Bank,"Government Peripheral Hospital 
M-2, Third Avenue,  Anna Nagar,  
(Near K-4 Police Station)
Chennai",044 26209490,NO,AB-
Government Kasthurbai Gandhi Hospital for Women & Children,"Victoria Hostel Rd, Triplicane, Chennai, Tamil Nadu","044 28545123, 044 28545001",NO,AB-
Institute of Obstetrics and Gynaecology Government Hospital for Women and Children,"Police Commisioners Rd, Egmore, Chennai, Tamil Nadu",044 28194896,NO,AB-
Government RSRM Hospital,"Cemetery Road, Royapuram, Chennai, Tamil Nadu ",044 25901665  ,NO,AB-
Chennai Port Trust Hospital Blood Bank,"No.10 Spring Heaven Road, George Town, Chennai, Tamil Nadu",044 25362201,NO,AB-
ESI Hospital Blood Bank,"The Blood Bank Medical Officer, ESI Hospital, Ayanavaram, 
Chennai",044 26449284,NO,AB-
Rotary Central TTK Voluntary Health Services (Dr Raganathan Memorial Blood Bank),"Tharamani, Adyar, Chennai, Tamil Nadu","044 22541692,  044 22542829",YES,AB-
 AA Lab Blood Bank,"Old No 12 New No 23, 5th Cross Street, Nungambakkam
Nungambakkam
Chennai, Tamil Nadu",044 28170930  ,YES,AB-
Sree Venkateswara Blood Bank,"158, Mannarswamy Kovil Street
Royapuram
Chennai, Tamil Nadu",044 25960226  ,NO,AB-
CSI Rainy Multi Speciality Hospital,"45, GA Road, Old Washermanpet, Chennai, Tamil Nadu ",044 40505050,NO,AB-
Dhanvandri Blood Bank and Research Centre of Sreemahalakshmi Charitable Health Trust,"F-1, 52A, T.Nagar, S W Boag Rd,CIT Nagar, Chennai, Tamil Nadu","044 24310660, 044 24310610",YES,AB-
ACS General Hospital ,"Run by Dr MGR Educational Reaserch Institute, Poonamalle High Road, Chennai- Bangalore Highway NH4, Velappanchava
Chennai, Tamil Nadu ","044 23782176, 044 23782186, 044 26802133",NO,AB-
Muthukumaran Medical College Hospital and Research Institute,"Chikkarayapuram, Chennai, Tamil Nadu","044 66344000, 044 24784000",YES,AB-
Tagore Medical College Hospital Blood Bank,"Vandalur - Kelambakkam Road, Melakkottaiyur Post, Near Vandalur, Rathinamangalam, Chennai, Tamil Nadu", 044 30101111,YES,AB-
Fortis Malar Hospitals Limited Blood Bank,"52, First Main Road, Gandhi Nagar, Adyar",044 42892222,YES,AB-
Madha Medical College and Hospital Blood Bank,"State Highway 113,Thandalam,Kovur, Harijana Colony
Chennai, Tamil Nadu",044 24780333  ,NO,AB-
Billroth Hospitals Limited Blood Bank,"No.56 & 57, New Door No,5& AMP:7 Gajapathy Street, Shenoy Nagar, Chennai",044 42921767,YES,AB-
Government Stanley Hospital Blood Bank,"305 OSH Rd, Royapuram, Chennai, Tamil Nadu",044 25284941,YES,AB-
M/S SRM Institutes For Medical Science," No.1 Block B, First Floor,
Jawaharlal Nehru Salai, ( 100 feet road) 
Vadapalani",044 23626815,YES,AB-
Government Kasturba Gandhi Hospital Blood Bank,Chennai,,,AB-
Sree Balaji General Hospital Blood Bank,"7, Works Road, Chrompet,Chennai",044 22415600  044 2241 5603,NO,AB-
Indian Red Cross Society Blood Bank,"Tamil Nadu Branch, No, 50 Montieth Road,Egmore","044 28554425, 044 28594888,",,AB-
The Tamil Nadu Dr. MGR Medical University Blood Bank,"69, Anna Salai, Guindy,Chennai",0442 22353546  044 2235 3547,YES,AB-
ESI Hospital Blood Bank,"ESI Hospital, Kamarajar Road, Uppilipalayam, Varadharajapuram(P.O)", 0422 2300871,NO,AB-
Coimbatore Medical College Hospital Blood Bank,"Trichy Road, Kallimadu, Coimbatore","0422 2301393, 0422 230 0871",YES,AB-
KG Hospital Blood Bank,"5, Government Arts College Road, Coimbatore","0422 2212121, 0422 2212129",YES,AB-
PSG Hospital Blood Bank,"Avinashi Road, Kalluri Nagar, Peelamedu, PSG Medical College And Hospital Campus, Coimbatore",0422 2570170,YES,AB-
G. Kuppusamy Naidu Memorial Hospital Blood Bank,"P.B. No. 6327, Nethaji Road, Pappanaickenpalayam,
Coimbatore","0422 4305336, 0422 224 5000",YES,AB-
Ramakrishna Hospital Blood Bank," No. 395 Sarojini Naidu Road , New Siddhapudur, Coimbatore ",0422 450 0000,YES,AB-
Ramana Gounder Medical Trust Hospital Blood Bank,"Mettupalayam Road, S. F. No. 47 and 48 Thudaiyalur ","0422 2642488, 0422 2642435",YES,AB-
Ganga Hospital Blood Bank,"No. 313, Mettupalayam Road, Saibaba Koil, Coimbatore ",0422 4250000  0422 248 5000,YES,AB-
Kongu Nadu Hospital Private Limited Blood Bank,"336 to 353 Dr. Rajendra Prasad Road, (100 feet Road) 11th St, Tatabad, Coimbatore","0422 4316000, 0422 2494303",,AB-
Lions Club of Coimbatore Legend Blood Bank Research Centre,"Red Rase Tower No.422 DB Road, R.S. Puram","04222477373, 04222470046",YES,AB-
Shanthi Social Services Medical Centre Blood Bank,"Neelikonampalayam, Coimbatore ",0422 2576122,YES,AB-
 Kuriji Hospital Blood Bank (A Unit of Vangal Amman Health Service Limited),"522/3, Udayampalayam Road, Sowripalayam Post",0422 2562744,NO,AB-
Sree Abirami Hospital Private Limited Blood Bank,"No. 33, Madukkarai Road, Sundarapuram, Coimbatore",0422 246 6666,YES,AB-
Government Hospital Blood Bank," Ooty main road, Mettupalayam, Coimbatore",04254 272275,NO,AB-
Sheela Hospitals Blood Bank,"No. 117, East Power House road, Tatabad,Coimbatore",0422 4334500,NO,AB-
Kovai Medical Centre and Hospital Blood Bank,"3209 Avinashi Road, Sitra, Coimbatore",0422 4323800,YES,AB-
IMA Rotary Midtown Mahaveer Blood Bank," 92, Syrian Church Road, RS Puram, Coimbatore  ","0422 6513322, 0422 6563322, 0422 247 1824",YES,AB-
The Coimbatore Bio Medical Services Blood Bank,"No.190A, Bashyakarlu Road East, R.S. Puram",0422 2552297,NO,AB-
Karpagam Hospital Blood Bank,"Pollachi Main Road, Othakkalmandapam, Coimbatore",0422 6554443,YES,AB-
Swaasam Blood Bank (Run by Any time Blood Voluntary Association),"Shop No. 9/3, Sakthi estate, M. G Road, Avarampalayam, 
Coimbatore",N/A,NO,AB-
RVS Hospital Blood Bank,"242-B, Trichy Rd,Mathiyalagan Nagar,Sulur,  ","0422 2682942, 0422 2682943",NO,AB-
Government Hospital Blood Bank,"Government Hospital, NH209,Mahalingapuram,Udumalpet Road,Pollachi",04259 229322,NO,AB-
Pollachi Blood Bank Services,"No : 6, Kanitha methai Ramaujam Street, Venkatesa Colony, Pollachi",04259 223414,NO,AB-
Rajah Muthiah Medical College and Hospital Blood Bank,"Annamalai Nagar, Chidambaram","04144 238147, Extn 28",YES,AB-
Kamaraj Government Hospital Blood Bank,"S.P.Kovil Street, Chidamabaram bus stand, Chidambaram",04144 223099,NO,AB-
Hi Tech Blood Bank and Research Foundation,"No. 2, Chinnappa Mudali Street Manja Kuppam",04142 230977,NO,AB-
Government Hospital Blood Bank,"Government  Hospital, Viruduchalam (T.K)",04143 231766,NO,AB-
Government Head Quarters Hospital Blood Bank,"Nellikuppam road, Cuddalore",04142 292052,NO,AB-
Blood Donor Association Blood Bank,"No. 17A, Hospital Road , Cuddalore","04142 231711,  04142 231715",NO,AB-
Neyveli Lignite Corporation,"NH532, M.K Colony, Neyveli, Tamil Nadu","04142 2522784, 04142 28364613",NO,AB-
Dharmapuri Medical College Hospital Blood Bank,"3/29A, Nethaji Bye Pass Road, Kamalakhsmi Colony,
Dharmapuri",04342 231748,NO,AB-
Ashok Blood Bank and Clinical Laboratory,"No. 63A, Sengodipuram Road IInd Floor, Dharmapuri",0434 2260627,NO,AB-
Om Sakthi Blood Bank,"No 4 Sengodipuram, Dharmapuri","04342 260388, 04342 261388",NO,AB-
Christian Community Health Center and Hospital Blood Bank,"Shanthipuram, Ambilikkai, Tamil Nadu ",04553 249050,NO,AB-
St.Joseph Hospital Blood Bank,"Chennai Theni Highway, Nehruji Nagar","04512 421130, 04512 426091, 04512 430399",NO,AB-
Indian Blood Bank,"2/2 Spencor&#39;s Compound
",0451 2429393,NO,AB-
Dindigul Blood Bank,"No. 28/2, Veppan thoppu street, Palani Road, Dindigul",0451 2427143   ext. 2429812,YES,AB-
Government Head quarters Hospital Blood Bank,"Trichy Road,New bus stand, Opp to North police station
",04511 2424600,NO,AB-
Leonard Hospital Blood Bank,"SH 155, Arunachalapuram, Batlagundu",04543 262670,NO,AB-
Palani Blood Bank (Run by Annai Educational Trust),"49, Dindigal Road, 1st Floor, Opposite to Government  Hospital, Dindigul",04545 245501,NO,AB-
Kasturba Hospital Blood Bank,Gandhigram,04510 2452328,NO,AB-
Christian Fellowship Hospital Blood Bank,"Dindigul Main Road, Oddanchathram","04553 241226,04553 241379",NO,AB-
Government Hospital Blood Bank,"Dindigul Road, South Anna Nagar, Palani",04542 248553,NO,AB-
Erode Blood Bank and Clinical Laboratory,"No. 43, Patel Road, 1st Floor,Erode",04242 253163,YES,AB-
Kongu Blood Bank,"TS No. 51/1E Ist floor, Perundurai Road","0424 2263537, 0424 2263536",,AB-
Lotus Blood Bank,(Lotus Apollo Hospital) Poonthurai Main Road,04242 282828,NO,AB-
Lions Club of Erode Supreme Charitable Trust Blood Bank,"No. 27 S.K.C Road, Erode ","0424 2257744, 0424 2277733, 0424 2277732",YES,AB-
Dhanvantri Charitable Trust Blood Bank,"No.1. Old Post office Road, Sathyamangalam",04295 2233322,,AB-
IRT Perunthurai Medical College Hospital Blood Bank,"Perundurai, Erode ",04294 220910  ,NO,AB-
Idayam Hospitals Erode Limited Blood Bank,"No.15, Palaniappa Street",04242 256456,NO,AB-
Sri Saanthi Blood Bank (Run by Kaveri trust),"6-9, kandappa Lane, Brough Road, Erode",,,AB-
Government Head quarters Hospital Blood Bank Erode,Erode,,,AB-
Government Hospital Blood Bank,"Government Hospital, Gobichettipalayam",04285 227153,NO,AB-
Sri Ram Blood Bank,"4/28, Govt Hospital Road, Gobichettipalayam, ","04285 222596, 04285 222 224",NO,AB-
Chengalpattu Medical College Hospital Blood Bank,"Anna Nagar, Chengalpattu","044 27431909, 044 2743 1221",YES,AB-
Shri Sathya Sai Medical College and Research Institute Blood Bank,"Tiruporur - Guduvancherry Main Road, Ammapettai, Chengalpat",044 27440700044 27440346   044 2744 0347,YES,AB-
Essar Blood Bank,"Arumbakkam Sri AS rajagopalan trust,  No 16. alagesan Road, Vedachalam Nagar",,,AB-
"Military Hospital Blood Bank, St. Thomas Mount","Defence Colony 1st Ave,Ekkatuthangal, Chennai",044 25316500,YES,AB-
Meenakshi Medical College Hospital and Research Institute Blood Bank,"Enathur, Karrapettai Post, Kanchipuram","044 27264096, 044 27261339",YES,AB-
Government Aringnar Anna Memorial Cancer Hospital Blood Bank," Bangalore High Road, Karaipettai","044 27264244, 044 27264246",NO,AB-
Government Head Quarters Hospital Blood Bank,"Hospital Road, Kanchipuram","044 27222307, 044 272223308",NO,AB-
Annai Medical College and Hospital Blood Bank (Run by Sri Devi Karumari Amman Educational Trust),"1st Floor Casuality Block, Dr. G. Jayarama Nagar, Pennatur, Sri Perumbudur Taluk",044 27162100,NO,AB-
SRM Medical College Hospital Blood Bank,"SRM Nagar, Potheri, Kattankulathur, Kancheepuram","044 27455707, 044 2745 5510",YES,AB-
Chettinad Hospital and Research Institute Blood Bank,"SH 121, Rajiv Gandhi Salai, Kelambakkam ",044 4741000,YES,AB-
Madurantakam Government Hospital Blood Bank,"Hospital Road, Madurantakam",044 27555216,NO,AB-
Karpaga Vinayaga Institute of Medical Sciences Blood Bank,"GST Road, Chinna Kolambakkam, Palayanoor P.O.
Madurantagam Taluk.
",044 27566050  044 2759 8484,,AB-
Government Hospital Tambaram Blood Bank,"Government Hospital Tambaram, GST Road, Chrompet",044  22382400,NO,AB-
Saveetha Medical College and Hospital Blood Bank (A unit of Saveetha Institute of Medical and Technical Sciences,"S.No. 302/1, Mavalur kuppam Village, Saveetha Nagar, Thandalam",044 26810299,,AB-
Deen Dayal Hospital Blood Bank,"No. 61, Deen Dayal Nagar, Kunnavalam Post, Tirupati Road,Thiruvallur Taluk,Tamil Nadu ",044 27677700,NO,AB-
M/s Marthandam Blood Bank,"2/64, AIFB Hospital Building, Junction Main Road, Marthandam",,,AB-
Sree Mookambika Institute Medical Science Blood Bank,"14-9C 15, Ist Floor, Medical College Hospital Building, Padanilam, Kulasekaram",04651 2788250,YES,AB-
Government Head Quarters Hospital Blood Bank,"Padmanabhapuram, Thuckalay, Kanyakumari",04651 256023,NO,AB-
"M/S Indian Medical Centre, Dr Kumarsawamy Health Center","Perumal Puram, Kottaram Post",,,AB-
Catherine Booth Hospital Blood Bank (Run By The Salvation Army),"M/s.  The Salvation Army Catherine Booth Hospital,
Arunachalam Colony, Nagercoil","04652 275516, 04652 275517",NO,AB-
Kanyakumari Medical College Hospital Blood Bank,"KGMCH,  Asaripallam",04652 236949,YES,AB-
AV Rajan Blood Transfusion Services Clinical and Research Laboratories,"No. 20/6-75 PWD Road, Rajappa Campus, Chettikulam, Nagercoil",04652 225427,NO,AB-
Royal Blood Bank  (Run by Royal Medical Trust),"No. 40/2 197 PWD Office Road, Peria Nadar Street, Nagerkoil",04652 229903,NO,AB-
Kanya Blood Bank,"No.173 A/1, K.P. Road, Ramavarmapuram, Nagercoil","04652 279850, 04652 273951",NO,AB-
Vivek Blood Bank," 253, K-11,  K.P. Road, Nagercoil","04652 230108, 04652 234408",YES,AB-
Dr. Jeyasekharan Medical Trust and Nursing Home Blood Bank,"No. 253, KP Road, Nagercoil, Kanyakumari, ","04652 230019,0465 230020,04652 230021  ",YES,AB-
Thangam Blood Bank (Run by Thangam Chartiable Community Health Trust) William Hospital,"No 252, II floor, william hospital complex, Krishnan Koil, Nagerkoil",04652 277955,NO,AB-
Bensam Hospital Blood Bank,"Kalliancaud, NH 66, Nagercoil","04652 232532, 04652 232533, 04652 232534, 04652 232535",NO,AB-
Lords Blood Bank (Run By Rajamony Memorial Educational Charitable Trust),"129, Main Road, Opposite to R.C. Church",04651 231112,NO,O+
Siventhi Blood Bank (Siventhi Medical Trust),"1/1 – 344 -A, M.S. Road,  Nagarkovil","04652 221221, 04652 221331",NO,O+
Kanyakumari Medical Mission CSI Hospital Blood Bank,"CSI Hospital, SH 180,Neyyoor",04651 222222,NO,O+
Karur Blood Bank,"No. 196/29, Kamarajapuram","0432 4236177, 0432 4236188",YES,O+
Government Head Quarters Hospital Blood Bank,"Government Headquarters Hospital, Karur",0432 4260197,NO,O+
M/S. Rainbow Blood Bank ( Run by rainbow Health &Educational Trust) ,"40 car street, Karur",,,O+
M/s Karur Voluntary Blood Bank and Laboratary,20 Kamachi Amman Koil Street,,,O+
M/S TCR Blood Bank ( Run by TCR hospital & Charitable Trust),"TCR Multi Speciality Hospital, No.1/450, Avvai Nagar,Near LIC, Krishnagiri.",04343 239393,NO,O+
Government Hospital Blood Bank,"SH 17, Denkanikotta Road, Hosur, 
",04344 222635,NO,O+
Arogya Blood Bank (A Unit of Arogya Seva Hospitals Private Limited),"35 Opposite CSI church , Denkanikottai road,
New Temple Land Hudco, Shanthi Nagar East, Hosur",04344 225555 ,NO,O+
Life Care Voluntary Blood Bank (Run by Life Care Trust),"Venus Arcade, No.2, Ground Floor and First Floor, Old Telephone Exchange Road, Near Parimalam School, Hosur",04344 221716,YES,O+
Government Head Quarters Hospital Blood Bank,"Gandhi Road, Old pet, Krishnagiri",04343 238880,NO,O+
Karunya Hospital Blood Bank,"No.46,  Ist Cross Co-Operative Colony",04343 235512,NO,O+
Government Rajaji Hospital Blood Bank,"Government Rajaji Hospital, Madurai",0452 2520950,YES,O+
Meenakshi Mission Hospital and Research Centre Blood Bank,"Lake Area, Melur Road, Madurai, Tamil Nadu ",0452 2588741  ,YES,O+
Thai Moogambigai Blood Bank and Clinical Laboratory,"No. 3 Ground Floor (Northern Side),  Javahar Cross Street,  Gandhi Nagar",0452 2535685,NO,O+
The Apollo Speciality Hospital Blood Bank,"No.14 Deputy Collectors Colony, Lake View Road, K.K. Nagar, Madurai",0452 2581147,YES,O+
Vadamalayan Hospital Blood Bank,"Vadamalayan Hospital, No.9B, PT Rajan Road, Chokkikulam, Reserve Police Line",0452 2545400,YES,O+
Sivan Blood Bank Run by Lakshmiammal Memorial Trust,"Plot No.10, D.No. 58A Kuruvikaran Salai, 1st Cross Street, Aringnar Anna Nagar",0452 2536562,YES,O+
Velammal Medical College Hospital and Reserach Institute Blood Bank,"Velammal Village, Madurai-Tuticorin Ring Road, Anuppanadi
Madurai",0452 25110033  ,YES,O+
Satyam Blood Bank,No. 21C Old Kuyavar Palayam Road ,0452 2330327,NO,O+
Annai Abirami Blood Bank,"171/1, Opposite S K G & CO, South Masi Street, Kondaiyanaidu Ln, Periyar, Madurai Main",0452 2339750,NO,O+
Vignesh Blood Bank,No. 101 Sivaganga Road,04522 582562,NO,O+
Madhura Blood Bank,"51 A, Harvey Nagar Main Road, Arasaradi",0452 4352535,NO,O+
Christian Mission Hospital Blood Bank,"E Veli St. Old Kuyavar Palayam Salai, Madurai Main, Madurai","0452 2326458, 0452 2326294",NO,O+
Government Head Quarters Hospital Blood Bank,"Government  Head quarters Hospital, Usilampatti, Madurai ",04552 252185,NO,O+
M/S Jeevan Blood Bank,"Plot No.363, East 4th Cross street, KK Nagar",,,O+
Government Hospital Blood Bank,"GovernmentHospital, MainRoad, Mayiladuthurai",04364 223451,NO,O+
Government Head Quarters Hospital Blood Bank,"Government Head Quarters Hospital, Nagapattinam",04365 248600,NO,O+
Bharath Clinical Laboratory and Blood Bank,"No. 71/13, Trichy Main Road, Namakkal",04286 22002705,NO,O+
Shharc Charity Blood Bank,"39A, Dr. Shankaram Road, Gandhi Nagar (Near BSNL Office), Namakkal",0428 6234552,NO,O+
Government Head Quarters Hospital Blood Bank,"Government Head Quarters Hospital, Namakkal",04286 221411,NO,O+
Government Hospital Blood Bank,"Government  Hospital, Rasipuram",04287 222878,NO,O+
Government Hospital Blood Bank Thiruchengode,"Thiruchengode, Namakkal.",,,O+
Vivekanandha Medical Care Hospital Blood Bank,"SF No.20/1,2, Elayampalayam, Tiruchengodu",04288 234677,YES,O+
Government Head Quarters Hospital Blood Bank,"Government  Head Quarters Hospital,Thuraiyur Main Road, Perambalur",04328 277128,NO,O+
Muthu Medical Center Blood Bank (Muthu Charitable Trust),"No.153 Mettu Street  Opposite to Vegetable Market Perambalur, Tamil Nadu",0432 8277477,NO,O+
Dhanalakshmi Srinivasan Medical College and Hospital Blood Bank,"1st floor Diagnostic Block, Trichy – Chennai Highways (NH 45) Siruvachur, Perambaulur",04328 327999,YES,O+
M/S Kanakesa Thevar Memorial Hospital Blood Bank,"No 66 Chinnaiah Street, Pattukottai",,,O+
Sree Meenakshi Multi Speciality Hospital Blood Bank (Run by Ayyamperumal and K Dakshinamoorthy Trust),"4215, South 4th Street,Pudukkottai",04322 220234,NO,O+
Government Head Quarters Hospital Blood Bank,"Government Head Quarters Hospital, Santhanathapuram
Pudukkottai",04332 228111,NO,O+
Government Hospital Blood Bank,"The Medical Officer,  Taluk Government  Hospital, Aranthangi",04371 270544 ,NO,O+
Government Headquarters Hospital Blood Bank,"Government Headquarters Hospital, Ramanathapuram",04567 228178,NO,O+
M/S Ramnad Blood Bank( Run by C.Lakshmiammal Memorial Trust),"No.1/225, &#34;Malligai illam&#34; Mahasakthi Nagar",,,O+
Government Hospital Blood Bank,"Cuddalore Main Road, Attur, Salem District
",04282 243771,NO,O+
Annai Blood Bank,"104/1, 1st floor, Sadagopar Street, North Udayarpalayam",04282 241401,NO,O+
Government Head Quarters Hospital Blood Bank,"Government Head Quarters Hospital, Mettur Dam",04298 245400,NO,O+
Government Mohan Kumaramangalam Medical College Hospital Blood Bank,"Super Specialty Block, Steel Plant Main Road, Salem","04272 210964,0427 238 3313",YES,O+
Sri Gokulam Hospital Blood Bank,"No. 3/60, Mayanur Road, Salem","0427 2448171, 0427 2448176",NO,O+
Sithi Vinayagar Blood Bank,"No, 1C Vidhyalaya Road, Salem","0427 2312577, 0427 2316440  ",NO,O+
Vinayaga Mission Kirubananda Variar Medical College Hospital Blood Bank,"Sankari Main Road, Chinna Seeragapadi, Salem",0427 3982000,YES,O+
KSM Blood Bank (Run by Maruti Charitable Trust),"245/10 , 5th Cross street, Brindavan Road, Fairlands, Salem 
","0427 2446788,  0427 2445453 ",YES,O+
Salem Blood Bank,"Run by SHHARC Charity Trust, 2A 3rd Agraharam,  (Opposite to Kasiwiswanathar Temple), Salem
",04272 265432,YES,O+
Kurinji Hospital Blood Bank,"Tee Jay salai, Five Roads, Salem
","0427 2433321, 0427 2433300, 0427 2433301, 0427 2433302",YES,O+
Maruti Blood Bank,"Door No. 5, 5/1, Srinivasa Complex, (First Floor) Ram Nagar, Meyyanur, Salem","0427 2444962, 0427 4040110",YES,O+
Sivaramji Blood Bank (Unit of Janaseva Trust),"No 266, Omalur main road","0427 2318003, 0427 2416760",NO,O+
Salem Steel Authority of India Salem Steel Plant,"Mohan Nagar, Salem",0427 2388263,NO,O+
Minu Labs and Blood Bank,"7.A/4, Ramakrishna Road, (Rajaji Road)","0427 2318881, 0427 2332425",NO,O+
S Palaniyandi Mudaliar Memorial Hospital Blood Bank,"No. 29 Cuddalore Road,  Ammapet, Salem
","0427 2244500, 0427 2240394, 0427 2240395 ",NO,O+
Sri Shellapha Hospital Blood Bank,"239, Rajaram  Nagar, Near Gandhi Stadium, Salem
","0427 2421266, 0427 2421277",NO,O+
M/S SKS Hospital Blood Bank ( Unit of SKS Hospital (I) Private Limited),"No 50/2, First Floor, Brindavan Road, Alagapuram",,,O+
KaraiKudi Blood Centre (Run by Vivekananda Trust),"1st Floor, No.24/7, Ayyanar Puram 2nd Street",04565 401644,NO,O+
Government Sivagangai Medical College Hospital Blood Bank,"Vanieyankudi, Sivagangai
",04575 246356,YES,O+
Government Head Quarters Hospital Blood Bank,"Government Head Quarters Hospital, Karaikudi, Sivagangai District
",04565 221782,NO,O+
Sri Kaali Blood Bank,"No. 165A Gandhi Adigal Salai, Kumbakonam,  Tamil Nadu ",0435 242 6037,NO,O+
Government Head Quarters Hospital Blood Bank,"Government Head Quarters Hospital, Dr. Moorthy Road, Kumbakonam",0435 2425104,NO,O+
Government Hospital Blood Bank,"Palaniappan St.Nadimuthu Nagar, Pattukkottai, ",04373 252080,NO,O+
Thanjavur Medical College Hospital Blood Bank,"Thanjavur Medical College Hospital, Thanjavur","04362 246452, 04362 240951, 04362 240124",YES,O+
Sri Kaali Blood Bank,"No. 32 Thirunagar, Thanjavur",0435 2426037,YES,O+
Voluntary Blood Bank,"No. 2936 West Main Road, Thanjavur",,NO,O+
KMR Blood Bank (Run by KMR Charitable Trust),"113A, (First Floor) Arulandha Nagar 7th Cross, Thanjavur",,NO,O+
Government Raja Mirasudar Hospital,"Government Raja Mirasudar Hospital, Thanjavur",04362 276880,NO,O+
Ambigai Blood Bank,"No, 1877/1 West Main Road, Thanjavur","04362 239032, 04362 32525",NO,O+
