name, address,number,Availability,BGroup
Paras Hospital Blood Bank,"C-1 Sushant Lok- 1 Sector-43 Phase- I
","0124-4585500, 0124-4585627",YES,O+
Nalwa Pathology and Microbiology Laboratory Blood Bank,"SCF-83, Commercial UE-1, Red Square market","01662-236218, 01662 230699",YES,O+
Central Medical Centre (CMC) Hospital Blood Bank,"Near Dabra Chowk Over Bridge, Hisar","01662 237476, 01662 232360",NO,O+
Haryana Blood Bank,"16, Model Town, NearJjindal Hospital ",0166 2221740,NO,O+
Manglam Blood Bank,"No 139, NH10-Tosham Road Connection Road, New Model Town, Jindal Hospital Road, ","01662 248767, 01662223367",YES,O+
Hisar Blood Bank,Hisar,01662 33291,,O+
Dr. Anant Ram Janta Hospital Blood Bank,"Hospital Road, Hisar, Barwala",0169 324 2096,NO,O+
"National Blood Bank, Kharab Hospital Blood Bank","47, Near Budhla Sant Mandir, Rishi nagar, ",01662 225900,YES,O+
Sarvodaya Blood Bank services,"Sravodaya Multi Speciality Hospital 
Opp. Red Cross Bhawan, Delhi Road, Hisar",0166 223 1031,YES,O+
General Hospital Blood Bank Hisar,"Civil Hospital Blood Bank, Near Bus Stand ",01662 275566,NO,O+
"Maharaja Agrasen Medical College, Agroha, Blood Bank",Opp. Agroha Dham,01669-281193/94 (Ext. 225),YES,O+
General Hospital Blood Bank Jhajjar,Model Town,01251 252410,NO,O+
General Hospital Blood Bank Jind,"Civil Hospital, DC Colony",01681 245454,NO,O+
National Blood Bank,"Kharab Hospital, Gohana Road, Jind",,,O+
Gangaputra Hospital and Research Centre Blood Bank,"Kaithal Road, Kandela",01681 237238,YES,O+
Smt. Indira Gandhi Government Multispeciality Blood Bank,"G. H. Sector-18, Bypass Road, Near bus stand, Kaithal By pass",,NO,O+
Haryana Institute of Medical Sciences (HIMS) Hospital Blood Bank,"NH-152, Village-Ujhana, Ambala Road, Kaithal",,,O+
Kapisthal Blood Bank,"Plot No. 11, Rishi Nagar, Kaithal
Karnal Road
","01746-234874, 01746 226874",NO,O+
General Hospital Blood Bank Karnal,"Old Court Road, Karnal",0184 2268899,YES,O+
Nirmal Institute of Medical Sciences and Technology Blood Bank,"69, Jarnally Colony, Opposite Kalpana Chawla Medical College, Karnal.","0184 2201999, 0184 2202999",YES,O+
Pandit Ram Prakash Hospital and Kidney Centre Blood Bank,"Civil Hospital Road, Karnal","0184 2252401, ",,O+
Save Life Blood Bank,"16, Jarnally Colony, 1st floor, Opposite to General Hospital, Karnal","0184 2207557, 0184 2207558",YES,O+
LNJP District Government Hospital Blood Bank ," Thanesar, Kurukshetra, SH-6, Kaithal Kurukshetra Road, ","0174 429 2716, 01744 293580, 01744 290344",NO,O+
Kurukshetra Blood Bank,"SCO.07-08 BASMENT,  Near LIC Building","01744 291914, 01744232010",YES,O+
Adesh Blood Bank,"NH - 1, Near Ambala Cantt., Village Mohri, TEHSIL. SHAHBAD (M)","01744-332000, 332001, 332002",,O+
Civil Hospital Narnaul ,"New Mohalla Mandi, Narnaul",01282-254288,NO,O+
General Hospital Blood Bank Mandikhera,"Mandikhera, Mewat",1268661022,NO,O+
Shaheed Hasan Khan Mewati Government Medical College Blood Bank  ,"Nalhar, Tehsil Nuh, Mewat",01267 282007,NO,O+
Diamond Blood Bank LLT,"Om premia Hospital, 56 km Stone,NH-2, Delhi Mathura Road, Palwal, Faridabad",01275 240240,YES,O+
General Hospital Blood Bank Palwal,New Sohna Road,01275 240099,NO,O+
Command Hospital Blood Bank,"Chandimandir Cantonment, Panchkula",,,O+
Alchemist Hospital Panchkula Blood Bank,"Sector 21, Panchkula","0172-7122960, 0172-7122967, 0172 7122966, 0172 7122967",YES,O+
District Hospital Panchkula Blood Bank,"Civil Hospital Blood Bank, Sector 6",0172 256 7228,NO,O+
N.C. Medical College and Hospital Blood Bank,"N.C. Medical College and Hospital, Panipat-Rohtak Road, Israna, Panipat",,,O+
Red Cross Blood Bank,"Indian Red Cross Society, Red Cross Bhawan, G.T. Road",0180 4002049,NO,O+
Prem Blood Bank,"A unit of Lala Harbhagwan Dass Memorial & Dr. Prem Hospital Pvt. Ltd., Bishan Sarop Colony, Opp Bus Stand, ","0180 2697191, 0180 2635900, 01804008431",YES,O+
Bharat Blood Bank,"467-D/4, West Press Colony, Near Bust Stand, Sukhdev Nagar", 0180 4019800,YES,O+
Panipat Blood Bank,"332-R Model Town, Near Ramlal Chowk","0180 4011150, 01802697887",NO,O+
Cygnus Maharaja Aggarsain Hospital Blood Bank,"Desraj Colony,Devi Mandir Area",,YES,O+
Rewari Blood Bank,"Shree Krishna Medical And Social Welfare Society, 53-RL, Model Town","01274 222607, 01274 222955",YES,O+
General Hospital Rewari Blood Bank,"Room No. 16, Government / Civil Hospital Blood Bank,  
Kayasthwara Mohalla, ","01274 253101,  01274 254 743",NO,O+
Bharti Blood Bank,Rewari,,,O+
Pandit Bhagwat Dayal Sharma Post Graduate Institute of Medical Sciences (PGIMS) Blood Bank,"Medical Road, Maharishi Dayanand University,
Rohtak","01262 211306, 01262 212306,  01262 281 304",YES,O+
General Hospital Blood Bank Sirsa,"Room No 25, G.H Sirsa, Near Jhunthra Dharmsala Sirsa","01666241155, 01666 240122",NO,O+
Shiv Shakti Blood Bank,"Guru Gobind Singh Marg, B Block,Opposite to Valmiki Chowk","01666 234735, 01666 234117 ",YES,O+
Bapu Maghar Singh Ji International Blood Bank,"Shah Satnam Singh Ji Speciality Hospital, 
Nohar Bhadra Road,Shahpur Begu, Near Shah Satnam Ji Dham, Dera Sacha Sauda","0166 6238687, 01666238659",YES,O+
Bapu Maghar singh ji,Sirsa,,,O+
General Hospital Blood Bank Sonipat,"Delhi Road, Near Maharana Pratap Chowk",0130 2231931,NO,O+
Sonipat Blood Bank,"Near Saxsena Hospital, Sector-14
TO Scheme No. -15",0130 2218999,NO,O+
Bhagat Phool Singh Government Medical College for Women Blood Bank,"Kanpur Kalan, Sonipat","01263 283041, 01263 283063",YES,O+
Shree MAA Blood Bank,"1st Floor, Goel Hospital, Jagadhri, Yamunanagar.
Opp Sapphire hotel, railway road, Near Krishna Bajaj auto agency",01732 646206,YES,O+
MLGH Trauma Centre Yamuna Nagar Blood Bank ,"Civil Hospital Blood Bank, Jagadhari, Above Trauma Center, 
Yamunanagar",0173 220 0106,YES,O+
Bilaspur Regional Hospital Blood bank,"Changer Sector Bilaspur, Near D.C.Office Bilaspur",1978221080,NO,O+
Chamba Regional Hospital Blood Bank ,"Regional Hospital, Chamba",01899 222210,NO,O+
Bhota Charitable Hospital Blood Bank,Hamirpur,01972 255096,NO,O+
Hamirpur Regional Hospital Blood bank," Agriculture Colony, Hamirpur,",01972 222223,NO,O+
 Dharamshala Zonal Hospital Blood Bank,"Zonal Hospital, Dharamshala",01892 227595,NO,O+
Dr Rajendra Prasad Government Medical College (RPGMC) Blood Bank Tanda,"Dr. Rajendra Prasad Government Medical College, Kangra at Tanda",1892267114,YES,O+
"Military Hospital,Yol Cant, Kangra","Yol Cantt, Kangra",,NO,O+
Civil Hospital Blood Bank Palampur,"Civil Hospital, Palampur, Kangra",01894 234101,NO,O+
Reckong Peo Regional Hospital Blood Bank ,"Reckong Peo, Kinnaur, Himachal Pradesh
",01786 222922,NO,O+
Kullu Regional Hospital Blood Bank ,"R.No. 320, Kullu Regional Hospital ",01902 224778,NO,O+
Netaji Subhash Chander Bose Zonal Hospital Blood Bank,"Netaji Subhash Chander Bose Zonal Hospital, Mandi",01905 222213,YES,O+
Rohru Civil Hospital Blood Bank ,"Rohru, Shimla",01781 240011,NO,O+
Indira Gandhi Medical College Blood Bank Shimla,"Department of BT and IH, Indira Gandhi Medical College, 
Near Lakkar Bazar",0177 2883440,YES,O+
Deen Dayal Updhayay Hospital Blood Bank,"DDU Complex, Shimla",0177 2658940,NO,O+
Kamla Nehru Hospital Blood Bank,"Kamla Nehru Hospital, NH-22, Near Mall Road",0177 2624081,NO,O+
Mahatma Gandhi Medical Services Blood Bank Rampur,"Mahatma Gandhi Medical Services Blood Bank Rampur,
Near Jakh Institute of Nursing",01782 233969,NO,O+
Nahan Regional Hospital Blood Bank ,"Regional Hospital, Nahan ",01702 223344,NO,O+
Malhotra Super Speciality Hospital Blood Bank ,"(A Unit of Malhotra Clinics Private Limited), SCO No. 8, Himuda Bhatoli Kalan, Opp.- Mahavir Spinning Mills, Baddi",01795 275009,YES,O+
Maharishi Markendeshwar Medical College and Hospital Blood Bank,"LADO, Sultanpur Road, Kumarhatti, Solan
",01792 395175,YES,O+
 Solan Regional Hospital Blood Bank,"Regional Hospital, Near Lakkar Bazar, Tank Road",01792 220159,NO,O+
Una Regional Hospital Blood Bank ,"Regional Hospital, Una",01975 226064,NO,O+
MMAB memorial District Hospital  Blood Bank Anantnag,"MMAB memorial Blood Bank, Janglat Mandi, District Hospital, Anantnag",01923 222170,NO,O+
Baramulla District Hospital Blood Bank,"District Hospital, Kanthbagh, Baramulla",01952 234203,NO,O+
Chodana Sub-District Hospital Blood Bank,"Sub-District Hospital, Chadoora, Budgam",01951 257236,NO,O+
Budgam District Hospital Blood Bank ,"ASYM District Hospital Campus, Near District Court Complex",1951255238,NO,O+
Doda District Hospital Blood Bank ,"District Hospital, Doda",01996 233689,NO,O+
District Hospital Blood Bank Ganderbal ,Ganderbal,0194 2416158,,O+
Government Hospital Blood Bank Gandhi Nagar,"Government Hospital, Gandhi Nagar, Jammu",0191 2430041 ,NO,O+
Government Medical College and Hospital Blood Bank,"Government Medical College and Hospital, Mahesh Pura Chowk, Bakshi Nagar","0191 2584290, 0191 2584291, 0191 2584292",NO,O+
Sri Maharaja Gulab Singh (SMGS) Hospital Blood Bank,"Shalamar Road, Indra Chowk, Jammu","0191 2547635, 0191 2547639",YES,O+
Bee Enn General Hospital Blood Bank,"Garden Avenue, Bhagwati Nagar, Talab Tillo, Jammu",1912555631,,O+
Sainik Asptal Blood Bank Satwari,"166, Military Hospital, C/o. 56 APO",0191 2456006,NO,O+
Acharya Shri Chander College of Medical Sciences and Hospital Blood Bank,"Acharya Shri Chander College of Medical Sciences and Hospital, N.H ByPass P.O Majeen",0191 2662324,YES,O+
Kargil District Hospital (Kargil Ladakh Kashmir Division) Blood Bank ,"District Hospital, Kargil Ladakh Kashmir Division, Jammu and Kashmir",001985-232213,NO,O+
Kathua District Hospital Blood Bank ,"District Hospital, Kathua ",01922 234323,NO,O+
Kishtwar District Hospital Blood Bank  ,"District Hospital, Near Bus stand Kishtwar.",01995 261410,NO,O+
Kulgam District Hospital Blood Bank ,"Kulgam Quzigund Road, opposite to Fruit mandi Kulgam",01931 260398,NO,O+
Handwara District Hospital Blood Bank,"Handwara Hwy, Shaheen Colony, Durashpora, Handwara",01955 262054  ,NO,O+
General Hospital Blood Bank,"153, General Hospital, C/o. 56 APO, Leh Ladakh ",01982 254746,,O+
SNM Hospital Blood Bank,"SNM Hospital, Main Bazar, Leh",01982 252014,NO,O+
Raja Sukhdev Singh District Hospital Poonch,"District Hospital, Poonch","01965 220152, 01965 220656",NO,O+
Pulwama District Hospital Blood Bank ,"District Hospital, Pulwama",01933 241530,NO,O+
General Hospital Blood Bank (Army),"150, General Hospital, Rajouri",01962 263921 ,NO,O+
Rajouri District Hospital Blood Bank ,"District Hospital,  kheora, Rajouri
",01962 263209,NO,O+
Ramban District Hospital Blood Bank ,"NH1A, Upper Bazaar, Ramban,",01988 266908,NO,O+
District Hospital Blood Bank Sambha ,"District Hospital, Near Sabzi Mandi, Samba",9419118345,,O+
District Hospital Blood Bank Shopian ,Shopian,01933 261845,,O+
Shri Maharaja Hari Singh (SMHS) Hospital Blood Bank,"SMHS Road, Near Gold Market, Karan Nagar, Srinagar, ","0194 2504801, 0194 2504802 (Extn. 512) ",YES,O+
92 Base Hospital Blood Bank,"92 Base Hospital, C/o. 56 APO,  Badami Bagh, Srinagar",0194 24660009 (Extn. 6528),NO,O+
Sher-I-Kashmir Institute of Medical Sciences (SKIMS) Blood bank,"Sher-I-Kashmir Institute of Medical Sciences (SKIMS), 
Anchar, Soura, Srinagar",0194 2401013,YES,O+
 Government Lal Ded Hospital Blood Bank,"Wazirbagh, Srinagar GPO, Srinagar","0194 2313714, 0194 2313716",YES,O+
Government Bone and Joint Surgery Hospital Blood Bank,"Government Bone and Joint Surgery Hospital, Near Barzulla bridge, Srinagar",1942432135,NO,O+
Jawahar Lal Nehru Memorial Hospital Blood Bank,"Jawahar Lal Nehru Memorial Hospital Blood Bank, Rainwari, Srinagar",0194 2507099,NO,O+
Command Hospital Blood Bank ,"Command Hospital, Uttari Kaman, C/o Uttari Kaman, Udhampur",,,O+
Udhampur District Hospital Blood Bank ,"Udhampur  District Hospital, Near ITI collage",01992-270402,NO,O+
Indian Red Cross Society Blood Bank Bokaro,"IRCS, Blood bank, Pandit Jawahar lal Nehru Marg, Near Airport, Sector 1 B.S. City","06542 224555, 06542 288137",NO,O+
Bokaro General Hospital Blood Bank,"Blood Bank, Bokaro General Hospital, Sector - 4, Bokaro Steel City",6542289076,YES,O+
K.M. Memorial Hospital & Research Center Blood Bank,"Blood Bank, K.M. Memorial Hospital & Research Center, By Pass Road Chas Bokaro",0651 236188189,NO,O+
Deoghar Sadar Hospital Campus Blood Bank ,"Blood Bank, Sadar Hospital, Deoghar ",9431950386,NO,O+
Patliputra Medical college and Hospital (PMCH) Blood Bank Dhanbad,"PMCH, Saraidhela, Dhanbad, PO. BCCL Township",0326 2230301,NO,O+
Central Hospital Blood Bank BCCL Dhanbad,"Blood Bank, Central Hospital, BCCL, Dhanbad",9470595563,NO,O+
S. N. Chakraborty Memorial Chakraborty Nursing Home Blood Bank,"Debraj Complex, Dhansar, Dhanbad",0326 2303621,NO,O+
Dwarka Das Jalan Memorial Hospital Bartand Blood Bank ,"Blood Bank Dwarka Das Jalan Memorial Hospital Bartand, Dhanbad",3262313525,NO,O+
Dumka Sadar Hospital Blood Bank ,"Near Town Hall, Dumka",6434236298,NO,O+
MGM Medical College Hospital Campus Blood Bank Jamshedpur,"Sakchi, Jamshedpur",0657 2230092 ,NO,O+
Jamshedpur Blood Bank ,"Stocking Road, Northern Town. Bistupur",0657 2431957,YES,O+
Garhwa Sadar Hospital Campus Blood Bank ,"Blood Bank, Sadar Hospital Garhwa",06561 222005,NO,O+
Giridih Sadar Hospital Blood Bank ,"Blood Bank, Sadar Hospital Giridih",06532 250357,NO,O+
Gumla Sadar Hospital Blood Bank ,"Blood Bank, Sadar Hospital Gumla, Jharkhand",9534032306,NO,O+
Hazaribag Sadar Hospital Blood Bank ,"Blood Bank, Sadar Hospital Campus Hazaribag",06546 265289,NO,O+
TISCO West Bokaro Hospital Blood Bank ,"Blood Bank, TISCO West Bokaro Hospital, Ghatotand, Hazaribagh",06545 262356,NO,O+
Koderma Sadar Hospital Blood Bank ,"Blood Bank, Sadar Hospital Koderma",9334516895,NO,O+
Latehar Sadhar Hospital Blood Bank,"Sub-Divisional Hospital Blood Bank, Latehar",9835589186,NO,O+
Lohardaga Sadar Hospital Blood Bank ,"Blood Bank, Sadar Hospital Lohardagga",6526222235,NO,O+
Pakur Sadar Hospital Blood Bank ,,9934347811,NO,O+
Palamu Sadar Hospital Blood Bank ,"Daltonganj, palamau",06562 222677,NO,O+
CCL Hospital Blood Bank Ramgarh,"Blood Bank, CCL Hospital, Nai Sarai Ramgarh Cantt, Argada Road",06553 231755,NO,O+
Military Hospital Blood Bank Ramgarh,"Blood Bank, Military Hospital, Ramgarh Cantt, Ramgarh",06553 225055,NO,O+
Apurva Blood Bank Ramgarh,Apoorva Blood Bank Ramgarh,9304842607,NO,O+
"Heavy Engineering Corporation, Plant Hospital Blood Bank","Sector III, HEC Campus, Opposite JSCA Stadium, Ranchi",0651 2444336,NO,O+
"Rajendra Institute of Medical Science (RIMS) Blood Bank, Bariyatu","Bariatu, Ranchi, Jharkhand",6512540656,YES,O+
CCL Hospital Blood Bank Ranchi,"Central Hospital,CCL, Gandhi Nagar, Kanka Rd, Ranchi ","0651 2230355,ext 7059",NO,O+
Indian Red Cross Society (IRCS) Blood Bank Morabadi,"Morabadi, Near Hockey Stadium, Ranchi",07091494670-75,,O+
Abdur Razzaque Memorial Weavers Hospital (ARAM) Blood Bank ,"Blood Bank, ARAM Apollo Hospital, IRBA, Ranchi",0651 7123123,YES,O+
Nagarmal Modi Seva Sadan Hospital Blood Bank,"Blood Bank, Nagarmal Modi Seva Sadan Hospital, Upper Bazar, Ranchi",9234460464,,O+
Rinchi Trust Hospital Blood Bank,"Rinchi Trust Hospital Blood Bank, Kathal More, Itki Road, Ranchi.",0651 6456780,YES,O+
Devkamal Hospital and Research Centre Blood Bank,"Bajra Bazar, Bajra, Near IIT Bus Stand, Itki Road",7549000645,NO,O+
Gurunanak Hospital and Research Centre Blood Bank ,"Gurunanak Hospital and Research Centre Blood Bank Unit, Station Road, Ranchi.",0651 2460506,NO,O+
Sainik Hospital Blood Bank Namkum,"Blood Bank, Sainik Hospital, Namkum, Ranchi",0651 2260245,,O+
Birsa Blood Bank Bariyatu,"RIMS Colony, Near Hill View Nursing Home, Bariyatu
",0651 2542437,NO,O+
Jharkhand Blood Bank Bariatu ,"Jharkhand Blood Bank, S. R. Complex,  Near Bariatu Masjid, Bariatu","09334439995, 09973161687",NO,O+
Archi Blood Bank Jharkhand ,"Baxi Avenew, Dr. J. Sharan Lane Bariatu Ranchi",0651 6455072,NO,O+
Sahebganj Sadar Hospital Blood Bank ,"Blood Bank, Sadar Hospital, Sahebganj",06436 222050,NO,O+
Simdega Sadar Hospital Blood Bank ,"Blood Bank, Sadar Hospital Simdega ",9905101190,NO,O+
Chaibasa Sadar Hospital Blood Bank ,"Blood Bank, Sadar Hospital Chaibasa, West Singhbhum ",9279221139,NO,O+
Kiriburu Meghahatuburu General Hospital Blood Bank,Kiriburu Iron Ore Mines,06596 245025,NO,O+
TATA (TISCO) Hospital Blood bank,"Blood Transfusion Unit, TISCO Hospital, Noamundi, Chaibasa",9234612775,NO,O+
Bagalkot Blood Bank,"Hanagal Shree Kumareshwar Hospital and Research Centre, Ilkal Road",0835 220420,NO,O+
B. V. V. Sanghas HSK Hospital Blood Bank,"Navanagar, Bagalkot",08352 235410 ,YES,O+
District Hospital Blood Bank Bagalkot,Navanagar,0835 4236030,NO,O+
M/s. Vijay Mahant Blood Bank,"Sri Basaveshwara Childrens Hospital & Research Centre,
Gorbal Naka",08351 270838,YES,O+
Mounesh Hospital&#39;s The Jhamkandi Blood Bank,"Near P.B. High School, Uma Rameshwar Road",08353 22357,NO,O+
Ramanagoudar Hospital Blood Bank," 2nd floor, CTS, No.4042/B17, Near Kathi Kalyan Mantap ",08350 281999,NO,O+
M/s. Sai Aadhar Hospital Blood Bank,"Sai Aadhar Hospital, Yadwad Road",08350 282100,NO,O+
K.L.E.Society & Medical Research Centre Blood Bank,Nehru Nagar,0832 2473777,YES,O+
Belgaum Blood Bank and Diagnostic Laboratory,"3137, Huns Talkies Road, (opposite to Central High School)",0831 2425835,NO,O+
District Hospital Blood Bank,Dr. B. R. Ambedkar Road,0831 2425073,YES,O+
Shree Mahaveer Blood Bank," 4th Floor, Radio Complex, CTS No. 116/1A, Shivaji Road",0831 2430759,NO,O+
M/s. Sri Sai Blood Bank,"Shri Sai Hospital, No:40/2, Laxmi Nagar Main Road,
Vadagaon",0831 2496444,NO,O+
Rotary Charitable Trust Blood Bank,"New Extension Area, Nippani",08338 221377,NO,O+
Rotary Seva Sangh Blood Bank," R. S. No. 211/B, Plot No. 14C, Yogikolla Road",0831 225300,NO,O+
Medical College Hospital Blood Bank,"Vijayanagara Institute of Medical Science (VIMS), Bellary",08392 235356,YES,O+
District Hospital Blood Bank Bellary,Bellary.,,NO,O+
Swamy Vivekananda Charitable Blood Bank,"D. No.130, Near TVS Show Room, Parvathinagar Main Road",0839 266938,YES,O+
Smt. Vasantidevi Baldota Blood Bank,"Baldota Colony, Dam Road, Hospet",0839 231901 ,YES,O+
Chiranjeevi Blood Bank,"Near Vijayanagara Colony, 100 Bed Hospital Road, Amaravathi",0839 262275  ,YES,O+
M/s. Sri Siddartha Medical College Hospital Blood Bank,"Sri Siddhartha Medical College & Hospital, T.Begur, Nelamangala Tq",,YES,O+
MVJ Medical College and Research Hospital Blood Bank,"Dandupalya, Kolathur Post, NH-4",080 27931473,YES,O+
BGS Global Hospitals Blood Bank,"No. 67, Uttarahalli Road",080 26255555,YES,O+
Harsha Hospital Blood Bank,"No. 193/4, Byraveshwaranagar, Sondekoppa Circle, N.H.4, Bengaluru.",080 27723695 (Not in use),NO,O+
Narayana Hrudayalaya Blood Bank,"University Medical Centre, (KMC) Hospital",080 27835000 ,YES,O+
Government Haji Sir Ismail Sait Gosha Hospital Blood Bank,"Near KSPCB Limited, Tasker Town, Shivaji Nagar",080 2286 6529,NO,O+
Swamy Vivekananda Voluntary Blood Bank,"No.20,3rd Floor, SGRR Complex, 1st Cross, Raja Ram Mohan Roy Road, S. R. Nagar",080 22224044,YES,O+
M/s. Aster CMI Hospital Blood Bank,"43/2, Bellary Rd,NH-4,Sahakar Nagar, Hebbal",080 43420213,YES,O+
M/s. East Point Hospital Blood Bank Virgonagar,"East Point college of Medical Sciences&Hospital, Janana Prabha Campus, Bidarahalli",080 25136246,YES,O+
Unique Blood Bank & Diagnostic Centre,"1st floor,S.L.N.Complex, City Market Square",080 2600685,NO,O+
SHUSHRUTHA VOLUNTARY BLOOD BANK,"The Blood Bank Medical officer
Sushrutha Voluntary Blood Bank,
No:875,Modi Hospital Road,  Near Pristine Hospital",080 23230777,NO,O+
Bengaluru Blood Bank and Diagnostic Laboratory,"Between 6th and 7th Cross, Opposite R.R.Gold Palace, Sampige Road,Malleshwaram",080 23347714,YES,O+
Bengaluru Rotary TTK Medical Service Trust Blood Bank,"New Thippasandra Main Road, HAL III Stage",080 25293486/ 9900153000/ 9900163000,YES,O+
KIMS Hospital Blood Bank,"K. R. Road, Visveswarapuram,Near Makkala Koota Bus Stop",080 26613225,YES,O+
Bangalore Baptist Hospital Blood Bank,"Bellary Road, Hebbal",080 22024700,YES,O+
Sanjaya Gandhi Accident Hospital and Research Institute Blood Bank,"Jayanagar East, Byrasandra",080 26564516,NO,O+
Victoria Hospital Blood Bank,"Fort Road, Bengaluru",080 26700001,YES,O+
M. S. Ramaiah Medical Teaching Hospital Blood Bank,Gokul Extension,080 22183100,YES,O+
Saint Martha&#39;s Hospital Blood Bank,Nrupatunga Road,080 40128243,YES,O+
Kidwai Memorial Institute of Oncology Blood Bank,Dr. M.H.Marigowda  Road,080 26094082,YES,O+
Transfusion Medicine Centre Blood Bank,NIMHANS Hosur Road,"080 26995435, 080 26995436, 080 26995437",YES,O+
St. John&#39;s Medical College Blood Bank,"Sarjapur Road, Bengaluru",080 22065045,YES,O+
Mallya Hospital Blood Bank,"No.2, Vittal Mallya Road","080 22277979	",YES,O+
Hindustan Aeronautics Limited - HAL Hospital Blood Bank ,"Suranjandas Road, Near HAL Airport, Vimanapura",080 22314632   ,NO,O+
Saint Philomena Blood Bank,"No.1, Nilsandra Road",080 40164348 ,NO,O+
K. C. General Hospital Blood Bank,Malleshwaram,080 23343791,NO,O+
Command Hospital Blood Bank Air Force,"Old Airport Road, Near Cambridge Layout, Domlur Village, Post Agram",080 25234632,YES,O+
E.S.I.Hospital Blood Bank,Rajajinagar,080 23013808,NO,O+
Rashtrotthana Blood Bank,"93/2 Keshava Shilpa 1st Mn Road, Kempegowda Nagar ",080 26610916,YES,O+
Dr. B. R.Ambedkar Medical College Hospital Blood Bank,"K.G.Halli, Bengaluru",080 25463442,NO,O+
Hosmat Hospital Unit of Phisicare Services Private Limited Blood Bank,"No.45, Magrath Road, Off. Richmond Road",080 25593796,NO,O+
Grace Blood Bank and Laboratory,"2, 10th Cross, Ganganagar, Bengaluru",080 23431233 ,NO,O+
Sri Sathya Sai Institute of Higher Medical Sciences Blood Bank,"EPIP Area, Whitefield","080 28411500, 080 28004600 ",YES,O+
Navarang Blood Bank,"No.2953, Ist Floor, Near Navarang Circle, M.K.K.Road, 
Rajaji Nagar, ",080 23521233 ,NO,O+
Bangalore Lions Service Trust - Lions Blood Bank,"Bhagwan Mahaveer Jain Hospital, Millers Road, Vasantha Nagar",080 22266807,YES,O+
Sri Jayadeva Institute of Cardiology Blood Bank,"Gurappanapaly Post, Banneraghatta Road",080 22977213,YES,O+
Vydehi Institute of Medical Science Hospital Blood Bank,"EPIP AREA, 06 WHITE FIELD",080 28410874 ,YES,O+
Akshay Voluntary Blood Bank,"No. 968, 2nd Floor, 41st Cross, 3rd Block. Opposite E.S.I. Hospital, Rajajinagar",080 23147303,YES,O+
Bowring and Lady Curzon Hospitals Blood Bank,"Shivaji Nagar, Bengaluru",080 25591362,NO,O+
Kempegowda Medical Service Trust - Millennium Blood Bank,"No.1082/9, Sreenivasa Prasanna Complex, Triveni Road, Yeshwanthpur, Bengaluru",080 23571001,NO,O+
S. K. Voluntary Blood Bank,"14/1,I Floor, MESA Complex, Old Tolgate Bus Stop, 
Magadi Main Road",080 23103524 ,YES,O+
Indira Gandhi Child Institute of Health Blood Bank,"South Hospital Complex, Dharamaram College Post",080 22443143,YES,O+
Rajarajeshwari Medical College Hospital Blood Bank,"5th Cross, Mysore Road, New Guddadahalli",080 65666768 ,YES,O+
Sanjeevini Trust Jayanagar Voluntary Blood Bank,"1897/A, Cellar Floor, Gulora, 26th Main Road, Sount End Cross Road, 9th Block, Jayanagar",080 26494748 ,YES,O+
Sri Vinayaka Charitable Trust  Jeeva Voluntary Blood Bank,"No. 23 and 84, Sharoff Basappa Commercial Complex, 2nd Main, Ist Cross, New Tharugpet",080 25990583,YES,O+
Indian Red Cross Society - Karnataka Red Cross Blood Bank,"Red Cross Bhavan, 326, Ist Floor, Race Course Road, Bengaluru",080 22268435,YES,O+
Apollo Hospitals (Imperial Cancer Hospital and Research Centre) Blood Bank,"Apollo Hospitals a unit of Imperial Cancer Hospital and Research Centre Limited, 154/11, Opp.I.I.M Bannerghatta Road",080 26304050 / 51,YES,O+
Vijayanagar Hospital Blood Bank,"No. 27, 17th Cross, M.C. Layout, Vijayanagar",080 23358800,NO,O+
Bangalore Institute of Oncology Blood Bank,"No. 8, P. Kalinga Rao Road, Sampangiram Nagar",080 40206121,NO,O+
Ocean Blood Bank,"No. 133-134, K. P. Broadway Road, Shivajinagar",080 25552199,NO,O+
Rotary K. R. Hospital Blood Bank," No. 75, Hanumanthanagar, 50 Feet Road, Bengaluru ",080 28437393,NO,O+
Veerayoga Institute of Medical Sciences Speciality Hospitals Blood Bank,"VIMS, No. 88, Marathhalli, Outer Ring Road",080 4269800,YES,O+
Columbia Asia Referral Hospital Blood Bank,"26/4, Brigade Gateway, Beside Metro Cash and Carry West West, Malleshwaram,",080 39898968,YES,O+
Sagar Hospital Blood Bank,"Sy. No.53, Shavige Malleshwara Hills, Kumar Swamy Layout, Banashankari",080 42999177  ,YES,O+
Fortis Hospital Private Limited Blood Bank,Bannerghatta Road,080 66214055 ,YES,O+
Fortis Hospital Private Limited Blood Bank,"14, Sheriffs Centre,Cunningham Road","080 41994515, 080 22261037",NO,O+
Sagar Hospital Blood Bank," 44/54, 30th Cross, Tilak Nagar, Jayangar Extension",080 26536712 ,YES,O+
Manipal Hospital Transfusion Services Blood Bank,"No.98, Rustombagh, HAL Airport Road",080 25024357,YES,O+
Yashomathi Medicare and Research Centre Private Limited Blood Bank,"2371/3, HAL Airport, Varthur Main Road, Munne Kolala, Marathahalli Post",080 43221019,YES,O+
Life Care Voluntary Blood Bank," No.126, 7th Block, Jayanagar, Opposite to Jayanagar Police Station",080 22446923,YES,O+
The Oxford Medical College Hospital Blood Bank and Research Centre," Yadavanahalli, Attibele (Hobli), Anekal Taluk",8030847115,NO,O+
Sakra World Hospital Blood Bank,"Sakra world Hospital (A Unit of Takshasila Hospitals Operating Private Limited), S.No. 52/2 and 52/3, Devarabeesanahalli, Varthur Hobli, Bellandur Post",080 49694916 ,YES,O+
Dr.Rajkumar (Appaji) Blood Bank," No.18, Krishi Bhavan, 2nd Floor, Hudson Circle",080 22108108,NO,O+
Sri Shankara Cancer Hospital and Research Centre Blood Bank,"Shankara Math premises, 1st cross, shankarapuram, Basavanagudi",080 26981101,YES,O+
Mediscope Blood Bank,"Mediscope Hospital, No.11, Pillanna Garden, 3rd stage",080 25466554  ,,O+
Sapthagiri Hospital Blood Bank,"No.15, Chikkasandra, Hesaraghatta Main Road",080 22791638,YES,O+
