name, address,number,Availability,BGroup
Mahatma Gandhi Hospital Blood Bank,"At Post - New Pargaon, TQ-Hatkanangale, Kolhapur","0230 2477081, 0230 2477082, 0230 2477083,  0230 2477308, 0230 2477309  ",NO,O+
Annasaheb Galatge Lions Blood Bank,"Doctor&#39;s Colony, Gadhinglaj, Kolhapur","02327 223100, 02327 226355",YES,O+
Acharya Shree Tulsi Blood Bank ,"Gate No.1232 Sangli - Kolhapur Road, Jaysingpur Udgaon, Kolhapur
","02322 227955, 02322 228455",NO,O+
Dr. D. Y. Patil Hospital Blood Bank,"Kadamwadi, Kolhapur","0231 2653286, 0231 2651027",YES,O+
Arpan Blood Bank - Blood Component and Apheresis Centre Kolhapur,"1st Floor, Saroj Appartment, Subhash Road 1315, &#39;C&#39; Ward,  Opposite to Shramik Bhavan, Laxmipuri, Kolhapur","0231 2640588, 0231 2640599, 0231 6617208",YES,O+
Sai Seva Medical Foundation - Vaibhavlaxmi Blood Bank,"1036/A, E- Ward, 1st  Floor, Deccan Engineering, Opposite to Parvati Multiplex, Rajaram Road, Kolhapur
","0231 6454949, 0231 2664949",YES,O+
Kolhapur Municipal Corporation Blood Bank,"C.T.S. 83 D-Ward, Near Kasba Gate Police, Chowky, Kolhapur
",0231 2541870,NO,O+
Vande Mataram Samajik Samstha&#39;s - Jeevandhara Blood Bank,"1648 E- Ward Saidarshan Hights , Opposite to Sarada Medical, Chandrakanth Candre Kalasangrahalay, Rajarampuri, 7th Lane, Kolhapur
","0231 2526363, 0231 2522223",YES,O+
Sanjeevan Blood Bank,"250/B/65  First Floor, Lucky Naresh Banglow, Opposite to Collector Office, Nagala Park, Kolhapur, 
","0231 2668031, 0231 2668032",YES,O+
Shri.R.R.Patil Shikashan Sheti sanshodhan Aani vikas sanstha Blood Bank,"M/s Adhar Blood Bank, 1st Floor, C.S. No. 16432 / 1, H No. 12/966, C/o. Dr. Dilip Joshi Hospital, Sambhaji Chowk, Rajaram Road, Ichalkaranji, Tal - Hatkanangle, Kolhapur","0230 2430073, 0230 2430074",YES,O+
Government Medical College General Hospital Blood Bank,"Blood Bank, Government Medical College & Hospital, Old Railway Station,  Gandhi Chowk, Latur","02382 257670, 02382 253017",YES,O+
IRCS - Dr. Bhalchandra Blood Bank,"Red Cross Bhavan, Gandhi Market, Latur ","02382 246078, 02382 254994",YES,O+
Smt. Saraswati Karad Blood Bank,"MIMSR Medical College and Y.C.R. Hospital, Vishwanath Puram,  Ambejogai Road, Latur","02382 227424, 02382 227028 (Extn. 242)",YES,O+
IRCS Nagappa Amberkhane Blood Bank,"Banshelki Road Near Nalegaon Railway Crossing Gate Udgir, Latur ",02385 258325,YES,O+
Arpan Blood Bank Latur,"H.No R-3-1030,  Old Sonawane Hospital, Near  Ashok Hotel, Main Road, Latur","02382 251476, 02382 252476",YES,O+
Mauli Blood Bank,"Gayatri Hospital, Barshi Road, Latur ",02382 224000,YES,O+
Global Hospital Blood Bank,"No. 35, Dr. Ernest Borges Road, Hospital Avenue, 
Opposite to Shirodkar High School, Parel, Mumbai.","022 67670101, 022 67670342",YES,O+
ACTREC,"Department of Transfusion Medicine, ACTREC, 
Tata memorial centre, 
Sector 22 Kharghar, 
Navi Mumbai.","022 27405000, Ext 5515;                                  Direct No. 022 27405073",YES,O+
Deepak Foundation&#39;s Anviksha Blood Bank,"Paras Darshan, M. G. Road, Ghatkopar, (E) Mumbai ","022 21026290, 022 21025927",YES,O+
Ashirwad Blood Bank,"Imperial Mahal, 2nd Floor  Above Shabana Stores, Khodadad Circle, Dr. B. A. Ambedkar Road, Dadar TT,  Mumbai","022 24154826, 022 24154827",YES,O+
Asian Heart Institute and Research Center,"ICICI Tower,  Bandra Kurla Complex, Bandra (E) Mumbai","022 66986666, 022 26508487",YES,O+
B.S.E.S M.G. Hospital Blood Bank,"Rotary D. G. Goenka Blood Bank, Near Railway Station Andheri (W), Mumbai","022 66487576, 022 66487577, 022 66487578, 022 26283557",YES,O+
Bandra Holy Family Hospital Society Blood Bank,"Saint Andrews Road, Bandra, Mumbai","022 30610300, 022 30610555, 022 26518373",YES,O+
Bhabha Atomic Research Centre Hospital Blood Bank,"BARC Hospital, Anushakti Nagar Mumbai","022 25598353, 022 25598361, 022 25558494 ",NO,O+
Bhatia General Hospital and Blood Bank,"Tukaram Javji Road, Tardeo, Mumbai","022 66660656, 022 66660032",,O+
Bombay Hospital Trust Blood Bank,"12, New Marine Lines Mumbai",022 22067676,YES,O+
Borivali Blood Bank (Doshi Memorial Charitable Trust),"3,4,5, Vithal Apartment, Near Ram Mandir, Mandpeshwar Road, Opposite, Flyover,  Borivali (w) ","022 28936203, 022 28935219",YES,O+
Breach Candy Hospital And Research Centre Blood Bank,"60 A, Bhulabhai Desai Road, Mumbai","022 23667811, 022 23872666",YES,O+
B. Y. L. Nair Hospital Blood Bank,"New OPD Building. 2nd Floor, Dr. A. L. Nair Road Mumbai Central, Mumbai ","022 23027644, 022 23027645, 022 23098150",YES,O+
Cama and Albles Hospital - Abdul Fazalbhoy Blood Bank,"Mahapalika Marg, Mumbai CST","022 22611667, 022 22611654, 022 22611647 (Extn. 319)                         022 22611648",NO,O+
Cumbala Hill Hospital And Heart Institute Blood Bank,"93-95, August Kranti Maidan, Mumbai","022 23803674, 022 23803336, 022 23514740, 022 23511551   ",YES,O+
Dr. Babasaheb Ambedkar Memorial Hospital - Central Railway Hospital Blood Bank,"Central Railway Byculla, (E) Mumbai","022 23791964, 022 23717246, 022 67452926, 022 67452950, 022 23726588",,O+
Dr. L. H. Hiranandani Hospital Blood Bank,"Hill Side Avenue, Hiranandani Gardens, Powai ","022 25763355, 022 25763356, 022 25763357, 022 25763344, 022 25763311",YES,O+
ESIC Model Hospital cum ODC Blood Bank,"Room No. 20/A, 1st Floor, ESIC Model Hospital cum ODC & PGIMSR, Central Road, M.I.D.C, Opposite to MIDC Police Station, Andheri (East), Mumbai ",022 28321361,YES,O+
Fortis Hospital Blood Bank,"Mulund Goregaon Link Road, Nahur , Mumbai ","022 67994370, 022 43654374",YES,O+
G. T. Hospital Blood Bank,"Near L.T.Marg Police Station, Mumbai","022 22031111, 022 22621468 (Extn. 1351)",NO,O+
Hematology Laboratory Blood Bank,"Parekh House, Ground Floor,
14 Mama Parmanand Marg, 
Mumbai.",022 23691297,YES,O+
Harilal Bhagwati Hospital Blood Bank,"S. V. P. Road, Borivali-W, Mumbai","022 28932461, 022 28932462, 022 28932463 (Extn.205, 409)",NO,O+
Suburban Hi-tech Blood Bank,"Shagun Building, 2nd Floor, 206, Rani Sati Road, Malad (E)","022 28714060, 022 28714070",YES,O+
Holy Spirit Hospital Blood Bank,"Mahakali  Road, Andheri (E), Mumbai","022 28200353, 022 28248505",YES,O+
Indian Red Cross Society Bombay City Branch Blood Bank,"Blood Centre, 141, Shahid Bhagatsingh Road, Town Hall Compound, Near R.B.I. Fort","022 40500400, 022 22663560, 022 22663195, 022 22677448",YES,O+
INS - Ashwini Blood Bank,"Near R. C. Church, Colaba, Mumbai",022 22151666 (Extn. 3764),YES,O+
Jaslok Hospital And Research Centre Blood Bank,"15, Dr. G. Deshmukh Marg, Mumbai","022 66573434, 022 66573035",YES,O+
K. B. Bhabha General Hospital Blood Bank,"R. K. Patkar Marg, Bandra (W), Mumbai","022 26422541, 022 26422775, 022 26405226 (Extn. 4103, 4104)",NO,O+
K. J. Somaiya Medical College and Hospital Blood Bank,"Somaiya Ayurvihar Complex, Eastern Express Highway, Sion, Mumbai ","022 24024671, 022 24020946, 022 24091855      ",YES,O+
Kapoorben Vasanji Lathiya Blood Bank - Nanavati Hospital," Dr Balabhai Nanavati Hospital,S V Road, Vile Parle (W), Mumbai ","022 26119924, 022 26182255, 022 26267500",YES,O+
K. E. M. Hospital Blood Bank,"Acharya Donde Marg, Parel, Mumbai","022 24107421, 022 24107246, 022 24107249, 022 24107000 ",YES,O+
Kohinoor Hospital Blood Bank,"Upper Basement, Room No. 29 to 43, Kirol Road, Off L.B.S Marg, Kurla (w)","022  67556737, 022  67556755, 022 30553055",YES,O+
Kokilaben Dhirubhai Ambani Blood Bank,"4 Bunglows, Achutrao Patwardhan Marg, Andheri (west), Mumbai ","022 30900900, 022 30972030",YES,O+
Lilavati Hospital and Research Centre Blood Bank,"A 791, Bandra Reclamation, Bandra (W), Mumbai","022 26751000, 022 26568000, 022 26437648",YES,O+
Lokmanya Tilak Municipal Hospital Blood Bank,"O. P. D. Building, 1st Floor, Sion (W), Mumbai","022 24021771,  022 24063494, 022 24063489",YES,O+
M. T. Agarwal Municipal General Hospital Blood Bank,"Dr. R. P. Road, Mulund (W), Mumbai","022 25640767, 022 25605730 (Extn. 308)",,O+
Mahatma Gandhi Seva Mandir Blood Bank,"Mahatma Gandhi Seva Mandir Hospital, 2nd Floor, Opposite to Bandra Lake, S. V. Road, Bandra (W), Mumbai  ","022 26431893, 022 26431897",YES,O+
Manas Serological Institute Blood Bank,"CTS NO-167 / 168 / A1, 101-104, Grace Plaza, S. V. Road, 
Near Railway Phatak, Jogeshwari (W), Mumbai ",022 26784546 ,YES,O+
Masina Hospital Blood Bank,"Sant Savta Marg, Byculla (E) ",022 23700715,YES,O+
Mumbai Port Trust Blood Bank,"Nadkarni Park, Wadala (E) Mumbai","022 66567722, 022 4145115",,O+
N.  Wadia Maternity  Hospital Blood Bank,"Acharya Donde Marg, Parel, Mumbai","022 24165638, Extn 124; 022 24146963,022 24146964,022 24146965,Extn 124",NO,O+
Matoshri Valbai Mulji Shah - Arpan Blood Bank,"Aniraj Tower,  Janta Market, L.B.S Marg, Bhandup (W), Mumbai","022 25951044, 022 25941142",YES,O+
Navjivan Blood Bank and Lab,"Shop No.1, Abhilasha II, Punjabi Lane Borivali (W)","022 28934122, 022 28935133, 022 28918144, 022 28921727, 022 25339495                                  ",,O+
P. D. Hinduja National Hospital And Medical Research Centre Blood Bank,"Veer Savarkar Road, Mahim (W), Mumbai","022 24447308, 022 24447309, 022 24447310",YES,O+
Meenatai Thackeray Blood Bank - Siddharth Hospital,"Siddharth Nagar, Prabhodhan Kridabhawan Marg,
Goregaon (W)","022 28797586, 022 28797587, 022 28722929                     ",YES,O+
Prince Aly Khan Hospital Blood Bank,"Aga Hall, Nesbit Road, Mazgaon, Mumbai ","022 23777934, 022 23777936, 022 23777800, 022 23777907, 022 23777908",YES,O+
Dr. R. N. Cooper General Hospital Blood Bank,"North south Road No-1, Juhu, Vile-Parle (W) Mumbai","022 26242609, 022 26247254, 022 26247255, 022 26247256 (Extn. 201, 203)",NO,O+
Rajawadi Blood Bank - Seth V. C. Gandhi & M. A. Vora Municipal General Hospital,"Seth V. C. Gandhi and M. A. Vora M, Rajawadi, Ghatkopar-(E), Mumbai","022 21025611 (Extn. 141, 122)",NO,O+
S. L. Raheja Hospital Blood Bank,"Mahim, Raheja Rugnalaya Marg, Mumbai","022 24445528, 022 66529682, 022 24449418",YES,O+
S. R. Mehta and Sir. K.P. Cardiac Institute Blood Bank,"Plot No. 96, Road No.31, King Circle Sion, (E) Mumbai  ","022 24035454, 022 2409 4732",YES,O+
Saifee Hospital Trust Blood Bank,"15/17, Maharishi Karve Marg, Opposite to Charni Road Station Mumbai",022 67571140,YES,O+
Sarvodaya Hospital Samarpan Blood Bank,"Office Building, 2nd Floor, Sarvodaya Hospital, LBS  Marg, Ghatkopar (W), Mumbai","022 25102511, 022 25100100",YES,O+
Seven Hills Health Care Private Limited Hospital Blood Bank,"Blood Bank, 2nd Floor, Block-16, Seven Hills Hospital,  Survey No.155, 156, 162 - 168 Part, Marol - Maroshi Road,  
Andheri (E), Mumbai ",022 67676719,YES,O+
Shushrusha Citizens Co-operative Hospital Blood Bank,"698-B Ranade Road, Dadar, Mumbai","022 24469579, 022 25288698",YES,O+
Sir J.J.Group of Hospital Blood Bank,"Main Building, Ground Floor, Sir J. J. Hospital, Byculla, Mumbai","022 23735555, 022 23739400 (Extn. 2248, 2238)",NO,O+
Sir J.J.Mahanagar Rakthapedhi,"Sir J.J Mahanagar Raktapedhi, F. D. Petit Building, J.J.Campus, J. J. Road, Byculla, Mumbai ","022 23735585, 022 23733531",YES,O+
Saint George&#39;s Hospital & Regional  Blood Bank,"Saint George&#39;s Hospital, Behind General Post Office, 
P. D&#39;Mello Road, Fort, Mumbai","022 22621420, 022 22620242 (Extn.1431)  ",YES,O+
Tata Memorial Hospital Blood Bank,"5th Floor, Service Block, Dr. E. Borges Road, Parel, Mumbai ","022 24177000, 022 24127096 (Extn. 4682, 4684)",YES,O+
The B.D. Petit Parsee General Hospital Blood Bank,"B.Petit Road, Cumballa Hill,  Mumbai","022 61186190, 022 61186192, 022 61186333",YES,O+
V. N. Desai Municipal General Hospital Blood Bank,"T. P. S. II, 11th Road, Santacruz (E) Mumbai","022 26182081, 022 357022, 022 26151506 (Extn.356, 357)",NO,O+
West Coast Blood Bank,"Basement 101, Moon Building, 798, Mori Road, Mahim(W), Mumbai",022 24444544 ,YES,O+
M/s. Balasaheb Thackerey Blood Bank,Mumbai,,,O+
M/s. Pallavi Blood Bank,Mumbai,,,O+
"ESI-PGIMSR, MGM Hospital Blood Bank",Mumbai,,,O+
M/s Sion Blood Bank,Mumbai,,,O+
Harkisandas  Marottamdas Hospital Blood Bank,Mumbai,,,O+
Government Medical College Blood Bank Nagpur,"Model Blood Bank, 2nd Floor, Hospital Building, Government Medical College & Hospital, Nagpur  ",0712 2744695,YES,O+
Super Speciality Hospital and Medical Post Graduate Institute Blood Bank,"Maenad Road, Near RST Cancer Hospital, Nagpur","0712 2703501, 0712 2746682",NO,O+
Indira Gandhi Medical College and Hospital Blood Bank,"IGMC Hospital, Central Avenue Road, Nagpur ","07122820134,0712 2728621, 0712 2774766",YES,O+
Daga Memorial Women Government Hospital Blood Bank,"Gandhibag, Nagpur","0712 2729202, 0712 2729333 ",NO,O+
Central India Institute of Haematology & Oncology&#39;s Blood & Blood Component Bank and Apheresis Unit,"Plot No-14/2, Park Corner, Bal Raj Marg, Near Loma Square, Dhantoli, Nagpur","0712 2430038 , 0712 2428972 , 0712 6464198",YES,O+
Jeevan Jyoti Blood Bank and Component,"J P Chamber, Madhav Nagar, Dakshin Ambakshari Road  Nagpur","0712 2231660,  0712 2230876",YES,O+
Dr. Hegdewar Blood Bank,"2, Sitaram Smruti, West High Court Road, Laxmibhuvan Square, Audumbar Apartment, Dharmpeth, Nagpur ","0712 2528292, 0712 2538900, 09922407171, 09881000203",YES,O+
Sainath Blood Bank,"531,Jaiswal Building, Above R.K. Traders, Old shukrawari Road, Sakkardara Nagpur",9422502066,YES,O+
Ayush Blood Bank and component Lab,"9th Floor, A wing, 901-905, 910-912, Lokmat Building, Nagpur","0712 6618666, 0712 5631137     ",YES,O+
Lifeline Blood Bank Components and Apherisis Centre Blood Bank,"Neeti Gaurav complex , 2nd Floor, Central Bazar Road, Lokmat Square, Ramdaspeth, Nagpur ","0712 6686666, 0712 6686665",YES,O+
Rainbow Blood Bank,"3rd Floor, 282, Rainbow Diagnostic Services Central Bazar Road, Ramdas Peth, Nagpur",0712 6636666,YES,O+
"NKP Salve Institute of Medical Science and Research Center (Lata Mangeshkar Hospital), Blood Bank","5, YMCA Complex, Digdoh Hills, Hingna Road, Nagpur","07104 236290, 07104 236291, 07104 232905",YES,O+
Nandkishor Education Society Trust - Arpan Voluntary Blood Bank,Nagpur,,,O+
Dr. Shankarrao Chavan Government Medical College and Guru Govindsinghji Memorial Hospital Blood Bank,"Vazirabad, Nanded ","02462 235711, 02462 235712, 02462 234702",YES,O+
Indian Red Cross Society Blood Bank,"Parsi Anjuman Complex, Vazirabad, Nanded      ","02462 236699, 02462 231012, 02462 236633, 02462 227335",YES,O+
Golvalkar Guruji Blood Bank,"Plot No.2-12-407, Bandhaghat Road, Vazirabad, Nanded",02462 243300,,O+
Arpan Blood Bank,"2nd Floor, Dayma Complex, Doctor Lane, Ghamodia,Nanded","02462 241587, 02452 239587",,O+
Guru Gobindsinghji Blood Bank,"Geeta Bhavan 1 & 2 Floor, House No 3-1-366, Near Government, Opposite to Ayurvedic College, Bus Stand Road, Vazirabad, Nanded          ",02462 233332,YES,O+
Nanded Blood Bank,"Shivaji Nagar ,Opposite to Adhar Hospital, Nanded ",02462 233810,YES,O+
Hazur Saheb Blood Bank,"2nd Floor, Opposite to Bank of India, Sant Kripa Market, GG Road, Nanded ","02462 248888, 02462 239999",YES,O+
Civil Surgeon - District General Hospital Blood Bank,"Nandurbar, Railway Station Road Survey No.406, Civil Hospital Compound,  Sakri Road, Near Collector Office Nandurbar  ","02564 202510, 02564 210135, 02564 226225, 02564 210122",NO,O+
Sahada Blood Bank - Shree Swami  Samartha Vaidyakiya  Shaikshanik and Sanshodhan Sanstha ,"C/o. 1st Floor, Shushrut Hospital, Khetiya Road, Survey 
No. 67/3, Plot No. 3, Sahada, Nandurbar",,NO,O+
Jankalyan Rakta Pedhi,"Nandurbar,1st Floor, Vivekanand Hospital, Desaipura, Nandurbar ","02564 226934, 02564 226935, 02564 222226 ",NO,O+
Malegaon Blood Bank,"2nd Floor, West End Complex, Satana Naka, Malegaon ",,YES,O+
Seva Blood Bank,"Nilkanth Building, Satana Naka, Satana Road, Malegaon, Nashik",02554 257077,YES,O+
Roachabai Sugnomal Manwani - Cantonment General Hospital Blood Bank,"Vadner Road, Devlali, Nashik","0253 2493365, 0253 24913377,  0253 2462068",,O+
Metro Blood Bank - District (Civil) Hospital Nashik,"District - Civil Hospital Blood Bank, Near Thakkar Bazaar,  Trimbak Naka, Nashik","0253 2318020, 0253 2577949",YES,O+
Sainik Aspatal Military Hospital Blood Bank,"Sainik Aspatal, Military Hospital, Deolali",,,O+
Ansar Blood Bank,"1398/1, Islampura, Industrial Society Compound, Quidwai Road, Malegaon, Nasik","02554 238383, 02554 230169, 02254 230039",NO,O+
Arpan Blood Bank and Blood Component Laboratory and Research Centre,"1st Floor, Office No.102/103, Dr. Athawale Chambers, Opposite to Gavkari Press Tilak Path, Nashik 
","0253 2311358, 0253 2576058",YES,O+
Jankalyan Blood Bank,"3, Shree Nagar, Old Gangapur Naka, Gangapur Road, Nashik
","0253 2573493, 0253 2575249",YES,O+
NDMVPS Medical College and Hospital Blood Bank,At Post Adgaon Dist Nashik ,"0253 2220522, 0253 2303930",YES,O+
Samta Blood Bank,"F-1, 1st Floor Suyojit Comercial Complex, Mumbai Agra Highway, Below Data Mastics, Mumbai Naka, Nashik 
","0253 2472499, 0253 2472599, 0253 2472699, 09975997867, 09975997863, 09975997864",YES,O+
Sanjeevani Blood Bank,"Nashik, Krushna-Chaya Bangla, Plot No. 10/11, Kurdukar Nagar, Behind Fame Theatre, Nashik Pune Road, Nashik ",0253 2411888  ,,O+
Jijau Mahila Sevabhavi Sansthan Nashik Blood Bank and Transfusion Research institute Blood Bank,"Ishwar Krupa Ganesh Nagar, Tidke Colony, Nashik ",0253 2232996,,O+
The Santajee Educational and Medical foundation Trust - Jeevan  Blood Bank ,"Suyojit City Center, G-11, 12, 13, S. No. 567/1/1 & 567/1/3 (CTS No. 7249 & FP No. 60) Mumbai Naka, Near Mahamarg Bus Stand, Nashik 
",7387348888,YES,O-
SMBT Institute of Medical Science and Research Centre - Blood Bank and Component,"SMBT Institute of Medical Science & Research Centre, Blood Bank & Component,  Block-101, Ground Floor, ‘A’ Wing, New SMBT Hospital Building, Survey No. 470, Nandihills Appt., At Post-Dhamangaon, Ghoti, Igatpuri, Nashik
",02553 222300,YES,O-
Hindustan Aeronautics Limited Blood Bank,"HAL, Aircraft Division, HAL, In Front of GES HAL High School, Ojhar Township, Niphad, Nashik
","02550 275845, 02550 278932 (Extn. 2589)",NO,O-
J.D.C. Bytco Hospital Blood Bank,"1st Floor, Bytco Hospital, Nashik Road, Behind Durga Garden, Shahu Path, Nashik","0253 2460251, 0253 24605352",NO,O-
Regional Referal Hospital Blood Bank,"Medical Superintendent, Regional Referal Hospital (Superspeciality Hospital) Blood Bank, Nashik",,,O-
Shri Krishna Blood Bank,"Dr. Patange Hospital Building, Ajay Nagar Omerga, Omerga,  Osmanabad  ","02457 252004, 02457 252232, 02457 252469",YES,O-
"Civil Surgeon, General Hospital Blood Bank","Civil Hospital Osmanabad, Tqand, Osmanabad ",02472 226924,YES,O-
Civil Surgeon - District General Hospital Blood Bank,"Blood Bank Civil Surgeon, District General Hospital Blood Bank, Subhash Road, Parbhani
","02452 223458, 02452 231287",YES,O-
Kanthak Sevabhavi Sanstha - New Life Blood  Bank,"Plot No 22, Survey No 389 and 394, Beside Gurudwara, Station Road, Parbhani ",02452 220222,YES,O-
Indian Red Cross Society Blood Bank,"Indian Red Cross Society (IRCS), (Late Manikbai Chandulal Saraf) Blood Bank, Near Government Silver Jubilee Hospital, Patas Road, Baramati, Pune",02112 222951,YES,O-
Pune Chest and General Hospital Blood Bank,"Aundh Cest Hospital, Aundh Camp, Pune","020 27285432, 020 27286458",NO,O-
Sasoon Sarvopchar Hospital Blood Bank,"Ground Floor, Section 5, Opposite to Central Medical Stores, Station Road, Pune","020 26126868, 020 24480431",YES,O-
Armed Forces Blood Bank,"Vanwadi Armed Force Medical College, Pune","020 26026038, 020 26306337",YES,O-
Jankalyan Raktapedhi Pune,"1003, Shukrawar Peth, Swargate - Saras Baugh Road, Near Natraj Hotel, Pune","020 24449527, 020 24444502",YES,O-
Inlaks Budharani Hospital Blood Bank,"7-9, Koregaon Park, Pune","020 66099999, 020 66099727, 020 66099703",YES,O-
Indian Serological Institute Blood Bank,"21, Anand Baugh, Navi Peth, Near Vaikunth, Pune","020 24535244, 020 24538453",YES,O-
Acharya Anandrushiji Blood Bank,"191-192, New Sadashiv Peth, S. M. Joshi Foundation Building, Near Patrakar Bhavan, Pune","020 24537627, 020 65250707, 020 24531600",YES,O-
Akshay Blood Bank,"Survey No.10/1/3, Unnati Nagar, Bantar High School, Hadapsar, Pune","020 26993247, 020 26993248,  ",YES,O-
Garware Blood Bank - Talegaon Rural Hospital,"Talegaon Dhabhade, Maval, Pune ","02114 223916, 02114 308399",YES,O-
Jehangir Hospital Blood Bank,"32, Sasoon Road, Pune ","020 66811722, 020 66811723,",YES,O-
KEM Hospital Blood Bank,"Sardar Moodliar Road, Rastha Peth, Pune","020 26125600, 020 66037324, 020 26125603",YES,O-
Grant Medical Foundation A.H. Wadia Trust Blood Bank,"40, Sassoon Road, Ruby Hall Clinic, Post Box No. 70, Pune","020 26166318, 020 66455264, 020 26163391",YES,O-
Bharati Vidyapeeth Medical Foundation Blood Bank,"Sector - 28, Dhankawadi, Pune Satara Road, Pune","020 40555555, 020 24379432",YES,O-
Padmashree Dr. D.Y. Patil (Vishweshwar) Blood Bank,"Padmashree, Dr. D. Y. Patil Medical College Hospital, Sant Tukaram Nagar, Pimpari, Pune","020 27423844, 020 27420439",YES,O-
Deenanath Mangeshkar Hospital Blood Bank,"Erandawane, Near Mhatre Bridge, Pune","020 26602307, 020 26602308, 020 26602313, 020 25420104",YES,O-
Poona Serological Institute Blood Bank,"C.T.S. No. 592, 3rd Floor, Dhanwantari Complex, Rasta Peth, Pune","020 26133387, 020 26141719, 020 27472876                     ",YES,O-
Sahiyadari Speciality Hospital Blood Bank,"Kokoan Mitra Mandal Medical Port Trust&#39;s Sahiyadari Speciality Hospital Blood Bank, Plot No-30 C, Erandvane, Karve Road, Pune ","020 25403232, 020 67213000",YES,O-
Aditya Birla Memorial Hospital Blood Bank,"Survey No:31, Near Morya Mangal Karyalay, Thergaon, Chinchwad, Pune ","020 30717690, 020 30717676",YES,O-
Rakesh Jain Memorial Blood Bank,"Poona Hospital and Reserch Centre 27, Sadashiv Peth, Pune  ","020 24331706, 020 66069000, 020 24338477",YES,O-
Noble Hospital Blood Bank,"B-007, Basement C/o. Noble Hospital, 153 Magarpatta City Road, Hadapsar, Pune  ","020 66285050, 020 66285199",YES,O-
Smt Kashibai Navale General Hospital Blood Bank,"Sr. No. 50/15 building NO.5 2nd Floor, Narhe, Ambegaon, Pune  ","020 241062299, 020 24699884, 020 24106274",YES,O-
Pimpari Serological Institute Blood Bank,"Esteem Tower, opposite K.S.B. Pump, Pune-Mumbai Highway, Kharalwadi, Pimpari ","020 27421179, 020 27427779",YES,O-
Chakan Blood Bank,"Sr. No. 4976/1/2 Gate No. 2401, Yashwantnagar Ambethan Road. A/P Chakan, Khed, Pune ",02135 202141,YES,O-
R.G Gholap Memorial Blood Bank,"Office No. 301, 3rd Floor Ashoka Centre, S. No - 47/14, Satara Road, Parvati, Pune","020 65402140, 9822442140, 8554942140",YES,O-
Kranti Mitra Mandal Charitable Trust Blood Bank,"1st Floor PMT Buiding Gadital, Hadapsar, Pune ","020 26992828, 020 64782828, 020 26993703",YES,O-
Krantiveer Chapekar Bandhu Blood Bank,"Pimpri Chinchwad Mahanagar Palika Talera Hospital, Tanaji Nagar Chinchwad, Pune  ","020 27610054, 020 27610042",YES,O-
The New Century Medical & Education Foundation Trust - NCORD Blood Bank & Aphaeresis Centre,"NCORD Blood Bank and Aphaeresis centre, S. No. 241/2/1, Geet Ganga Building, Medipoint Hospital Lane, Baner, Pune",020 46608585,YES,O-
Ekta Apang Vikas Sanstha Blood Bank,"Office No. 17/18/19, 1st Floor, Sunshree Woods Commercial Complex, NIBM, Kondhwa, Haveli, Pune",020 26855144,YES,O-
Chattrapati Shahu Maharaj Pratisthan,"S.No. 30, 4th floor, office no. 41, 402, 403, and 5th floor off 502, waris Heights, Pune-Satara Road, Dhankwadi, Pune",N/A,YES,O-
Chattrapati Shahu Maharaj Pratisthan Blood Bank,"S. No. 30, 4th Floor, Office No. 41, 402, 403, and 5th Floor off 502, Waris Heights, Pune - Satara Road, Dhankwadi, Pune",020 65267000,YES,O-
M/s. Vidyashree Charitable Trusts Om Blood Bank,Pune,,,O-
District Civil Surgeon Blood Bank,"District Hospital Blood Bank, Civil Hospital Campus, Sea Face Road, Alibag  ",02141 225734,YES,O-
Kakasaheb Chitle Memorial Centre Sanchalit - Jankalyan Blood Bank,"C.S. No. 1651, Near Lokmanya Vyayamshala, Shiwaji Chowk, Mahad, Raigad","02145 222604, 02145 225103, 02145 224807 ",NO,O-
M.B. More Foundation Blood Bank,"Ghar. No. 412, 1st Floor, Mangaon, Morba Road, Opposite to Civil Hospital, Mangaon, Raigad
",,NO,O-
Advanced Centre for Treatment Reasearch and Education in Cancer,"Owe Village, Sector 22, Plot No. 2, Kharghar, Navi Mumbai ",022 27405073,YES,O-
M/s. Navi Mumbai Blood Bank,"Navi Mumbai Blood Bank, Vishwanath Bhavan, C-87, Sector 12, Kharghar, Navi Mumbai",,YES,O-
Shree Sai Blood Bank & Component,"103,104,105,1st Floor Tirthraj Building, Old Thana Naka Road, Near Taluka Police Station,  Old Panvel, Raigad","022 27467856, 022 27450885, 022 27463796",YES,O-
Rotary Club New Panvel charitable Trust s Late Dr. B.V. Limaye Blood Bank,"Plot No-8, Sect.1, Khanda Colony, Mumbai Pune Road, New Panvel (W) ","022 27459322, 022 32092960",YES,O-
Civil Surgeon - General Hospital Blood Bank,"Civil Hospital, Ratnagiri",02352 225616,YES,O-
Shree Swami Samarth Blood Bank,"B.K.L.Walwalkar Hospital Diagnostic & Research Centre, Shree Kshetra Darvan, Chiplun, Ratnagiri","02355 264137, 02355 264149, 02355 264181            ",YES,O-
Indian Red Cross Society Blood Bank,"Khareghat Road, Ratnagiri","02352 223262, 02352 222347",YES,O-
Indian Red Cross Blood Bank,Ratnagiri,,YES,O-
Prakash Blood Bank & Blood Component Seperation Unit,"Prakash Shikshan Mandal&#39;s Prakash Hospital & Research Centre, Islampur Sangli Road, Uran - Islampur, Tal -Walwa, Dist- Sangli (Ms)
","02342 661212, 02342 661224",YES,O-
Padmabhushan Vasantdada Patil Government Hospital Blood Bank,"Padmabhushan Vasantdada Patil Government Hospital , Blood Bank, Dr. Ambedkar Road, Sangli .                                         
","0233 2374651, 0233 2374652, 0233 2374653, 0233 2374654, 0233 2374655",NO,O-
Rajaram Bapu Blood Bank,"Islampur C.S. No. 99/1, Near Islampur Spiral CT-Scan,
Peth-Sangli Road
",02342 224939,YES,O-
